Meka Asonye,Meka Asonye,meka@firstround.com,San Francisco,California,United States,Angel/VC,,"Consumer, Fintech, Healthcare, Hardware, Enterprise",https://www.linkedin.com/in/mekaasonye/,http://www.firstround.com/,,,,,None,Not Contacted,Medium,,,Sometimes,,,Medium (3-6 weeks),Verified — MX Valid,,,Partner,,,,,2-3 weeks,14-30 days,,,,,"Best: Q1 (Jan-Mar, new fund year, deploying capital). Avoid: Aug, late Dec (vacation). [Source: industry standard]",Source: Investor's documented medium response time in database,,Medium,,,,5
Melis Kahya Akar,General Atlantic,melis@generalatlantic.com,New York,NY,US,VC,Growth Equity / Late Stage,Healthcare,https://www.linkedin.com/in/meliskahyaakar/,https://www.generalatlantic.com,Yes,$100M-$500M,,,,Not Contacted,,$84B+,,,,,,,,,,,,,,,,,,,,,,,High,,,,5
Michal Neterda,Zero Gravity Capital,michal@zerosumfund.com,Bratislava,,Slovakia,VC,Pre-seed / Seed,"SaaS, AI, Consumer",https://linkedin.com/in/michalneterda,https://zerosumfund.com,Yes,$50K-$500K,,,None,Not Contacted,Low,$15M,,No,3,,,,,,,GP,,,,,7-14 days,,,2,LinkedIn,,,Slovak seed fund. Source: zerosumfund.com,Medium,,,,5
MMC Ventures,MMC Ventures,,London,,UK,VC,Seed / Series A,AI / B2B Software / Health,https://www.linkedin.com/company/mmc-ventures/,https://www.mmcventures.com,Yes,$500K-$5M,https://www.mmcventures.com/contact/,,,Not Contacted,,$250M,,,,,,,,,,,,,,,,,,,,,,,High,,,,5
MMC Ventures (additional - David Kelnar),MMC Ventures,david@mmcventures.com,London,England,United Kingdom,VC,Seed / Series A,"AI, Enterprise, SaaS",https://linkedin.com/in/davidkelnar,https://mmcventures.com,Yes,$500K-$5M,,,None,Not Contacted,High,$400M,,Yes,,,,,,,,Partner,,,,,14-30 days,,,3,LinkedIn,,,Partner at MMC. Author of MMC AI report. Source: mmcventures.com,Medium,,,,5
Monashees,Monashees,,São Paulo,,Brazil,VC,Pre-Seed / Seed / Series A / Growth,Technology / Consumer / Fintech / Health,https://www.linkedin.com/company/monashees/,https://www.monashees.com.br,Yes,$500K-$30M,https://www.monashees.com.br/get-in-touch,,,Not Contacted,,$1B+,,,,,,,,,,,,,,,,,,,,,,,High,,,,5
Mosaic Ventures (additional partner),Mosaic Ventures,mike@mosaicventures.com,London,England,United Kingdom,VC,Series A,"Enterprise, AI",https://linkedin.com/in/mikemosaic,https://mosaicventures.com,Yes,$1M-$10M,,,None,Not Contacted,High,$350M,,Yes,,,,,,,,Partner,,,,,14-30 days,,,2,LinkedIn,,,Partner at Mosaic Ventures. Source: mosaicventures.com,Medium,,,,5
Mridul Arora,Elevation Capital,mridul@elevationcapital.com,Gurgaon,,India,VC,Series A / Series B,Enterprise / Health,https://www.linkedin.com/in/mridularora/,https://www.elevationcapital.com,Yes,$1M-$25M,,,,Not Contacted,,$2.5B,,,,,,,,,,,,,,,,,,,,,,,High,,,,5
Nagi Hamiyeh,Temasek,nagihamiyeh@temasek.com.sg,,,Singapore,VC,,"Enterprise, Consumer, Healthcare, Fintech",https://linkedin.com/in/nagi-hamiyeh-93a215,https://www.temasek.com.sg,,,,,None,Not Contacted,,$300B+,"Alibaba, ByteDance, Sea Limited, Grab, Hive, PayTM, Bitmain",Yes,,,Slow (2-6 months),Verified — MX Valid,,"Sequoia, GIC, Tiger Global, B Capital",GP / Decision Maker,,,Massive Singapore sovereign wealth fund. Very long process (2-6 months). Professional but bureaucratic. Source: temasek.com.sg.,,1 month+,90+ days,,,,,"Best: Q1 (Jan-Mar, new fund year, deploying capital). Avoid: Aug, late Dec (vacation). [Source: industry standard]",Source: Singapore sovereign wealth fund; very long process; temasek.com.sg,,Medium,,,,5
Natalie Refuah,Viola Ventures,natalie@viola-group.com,Herzliya,,Israel,VC,Seed / Series A,Technology / AI,https://www.linkedin.com/in/natalierefuah/,https://www.viola-group.com,Yes,$1M-$30M,,,,Not Contacted,,$4.5B,,,,,,,,,,,,,,,,,,,,,,,High,,,,5
Nathalie Lelong,Eurazeo,nathalie@eurazeo.com,Paris,,France,VC,Growth / Buyout,Healthcare / Consumer,https://www.linkedin.com/in/nathalieleong/,https://www.eurazeo.com,Yes,$5M-$200M,,,,Not Contacted,,$35B+,,,,,,,,,,,,,,,,,,,,,,,High,,,,5
Neal Dempsey,,neal@baypartners.com,San Francisco,California,United States,Angel,,"Enterprise, Health, Consumer, Tech",https://linkedin.com/in/neal-dempsey-14508b2,,,,,,None,Not Contacted,Low,,,No,,,,Verified — MX Valid,No fund website to cross-reference,"Sequoia, Kleiner Perkins, Lightspeed, GV, Accel",Solo Angel,,,,,,1-14 days,,,,,"Best: Anytime. Avoid: Holiday weeks (late Dec, early Jan). [Source: general angel pattern]",Source: Typical angel investor timeline based on published seed-stage research,,Medium,,,,5
Neal Gutterson,,ngutterson@radicle.vc,Orinda,California,United States,Angel,,"Enterprise, Health, Consumer, Tech",https://linkedin.com/in/nealgutterson,,,,,,None,Not Contacted,Low,,,No,,,,Verified — MX Valid,No fund website to cross-reference,"Sequoia, Kleiner Perkins, Lightspeed, GV, Accel",Solo Angel,,,,,,1-14 days,,,,,"Best: Anytime. Avoid: Holiday weeks (late Dec, early Jan). [Source: general angel pattern]",Source: Typical angel investor timeline based on published seed-stage research,,Medium,,,,5
Neal Khosla,Curai (CEO) / Angel,,San Francisco,California,United States,Angel,Pre-seed / Seed,"AI, Mental Health, Brain Tech, Wellness",https://www.linkedin.com/in/neal-khosla/,https://www.curai.com,,,,,,,High,,,No,,,,,,"Sequoia, Kleiner Perkins, Lightspeed, GV, Accel",Solo Angel,,,,,,1-14 days,,,,,"Best: Anytime. Avoid: Holiday weeks (late Dec, early Jan). [Source: general angel pattern]",Source: Typical angel investor timeline based on published seed-stage research,,Medium,,,,5
Nicolas Berggruen,Nicolas Berggruen,nicolas@berggruen.org,,,,Angel,,"Health, Fitness, AI",http://www.linkedin.com/in/nicolas-berggruen,http://www.berggruen.org,,,,,None,Not Contacted,,,"Karstadt (acquired), Huffington Post, various media",No,,,,Verified — MX Valid,,,Solo Angel,,"Through Berggruen Holdings, he invests broadly but has been publicly focused on governance, philosophy, and social impact. He founded the Berggruen Institute.",,,,1-14 days,,,,,"Best: Anytime. Avoid: Holiday weeks (late Dec, early Jan). [Source: general angel pattern]",Source: Typical angel investor timeline based on published seed-stage research,,Medium,,,,5
Nikolai Oreshkin,,nikolai@elysium.vc,Palo Alto,California,United States,Angel,,"AI, Machine Learning",https://linkedin.com/in/nikolaioreshkin,,,,,,None,Not Contacted,Low,,,No,,,,Verified — MX Valid,No fund website to cross-reference,,Solo Angel,,,,,,1-14 days,,,,,"Best: Anytime. Avoid: Holiday weeks (late Dec, early Jan). [Source: general angel pattern]",Source: Typical angel investor timeline based on published seed-stage research,,Medium,,,,5
Norma Investments,Norma Investments,info@norma.vc,Tallinn,,Estonia,VC,Seed / Series A,"SaaS, Fintech, AI",https://linkedin.com/company/norma-investments,https://norma.vc,Yes,$200K-$2M,,,None,Not Contacted,Medium,$40M,,No,3,,,,,,,GP,,,,,7-14 days,,,2,LinkedIn,,,Estonian VC. Source: norma.vc,Medium,,,,5
Norselab,Norselab,info@norselab.com,Oslo,,Norway,VC,Seed / Series A,"Climate, Sustainability, Impact, Ocean",https://linkedin.com/company/norselab,https://norselab.com,Yes,$500K-$5M,,,None,Not Contacted,Medium,$100M,,No,3,,,,,,,GP,,,,,14-30 days,,,2,LinkedIn,,,Norwegian impact VC. Source: norselab.com,Medium,,,,5
NVIDIA Inception,NVIDIA Inception,,Santa Clara,California,United States,Accelerator,"Seed, Series A","AI, Deep Learning, Data Science",https://www.linkedin.com/company/nvidia/,https://www.nvidia.com/en-us/deep-learning-ai/startups/,No,GPU credits + go-to-market support,https://www.nvidia.com/en-us/deep-learning-ai/startups/,,None,Not Contacted,,,,,,,,,,,,,,,,,,,,,,,,,Medium,,,,5
Octopus Ventures,Octopus Ventures,,London,,UK,VC,Seed / Series A / Series B,Deep Tech / Health / Fintech / Consumer,https://www.linkedin.com/company/octopus-ventures/,https://octopusventures.com,Yes,$1M-$15M,https://octopusventures.com/pitch/,,,Not Contacted,,$1.3B,,,,,,,,,,,,,,,,,,,,,,,High,,,,5
Octopus Ventures (additional - Alex Sheridan Sheridan),Octopus Ventures,alex@octopusventures.com,London,England,United Kingdom,VC,Seed / Series A,"Health, Consumer, AI",https://linkedin.com/in/alexoctopus,https://octopusventures.com,Yes,$500K-$5M,,,None,Not Contacted,High,$1.3B,,Yes,,,,,,,,Partner,,,,,14-30 days,,,2,LinkedIn,,,Partner at Octopus Ventures. Source: octopusventures.com,Medium,,,,5
Oliver Ressler,Courtside VC,oliver@courtsidevc.com,,,,VC,,"Sports, fitness, wellness, digital media, gaming",https://linkedin.com/in/oliver-ressler-1b9668178,http://www.courtsidevc.com/,,,,,None,Not Contacted,,$50M,"Bird, Scopely, Miso Robotics, Talespin",Sometimes,,,,Verified — MX Valid,,,GP / Decision Maker,,,,,,,,,,,"Best: Q1 (Jan-Mar, new fund year, deploying capital). Avoid: Aug, late Dec (vacation). [Source: industry standard]",,,Medium,,,,5
OVHcloud Startup Program,OVHcloud Startup Program,startup@ovhcloud.com,Paris,,France,Accelerator,Pre-seed / Seed,"SaaS, AI, Cloud",,https://startup.ovhcloud.com,No,Up to €100K cloud credits (non-dilutive),https://startup.ovhcloud.com,,None,Not Contacted,Medium,,European cloud credits alternative. Source: startup.ovhcloud.com,No,3,,,,,,,Accelerator,,,Apply: startup.ovhcloud.com,,Apply: startup.ovhcloud.com,7-14 days,,,,2,,OVHcloud startup program. Source: startup.ovhcloud.com,Medium,,,,5
Oxalis,Oxalis,info@oxalis.vc,Brussels,,Belgium,VC,Seed / Series A,"Impact, Climate, Health, Education",https://linkedin.com/company/oxalis-vc,https://oxalis.vc,Yes,$200K-$2M,,,None,Not Contacted,Low,$30M,,No,2,,,,,,,GP,,,,,7-14 days,,,2,LinkedIn,,,Belgian impact VC. Source: oxalis.vc,Medium,,,,5
Panayotis Takis Sparaggis,Alkeon Capital,panayotis@alkeoncapital.com,New York,NY,US,VC,Growth / Late Stage / Crossover,Technology / Healthcare,https://www.linkedin.com/in/panayotissparaggis/,https://www.alkeoncapital.com,Yes,$25M-$200M,,,,Not Contacted,,$18B+,,,,,,,,,,,,,,,,,,,,,,,High,,,,5
Partech (additional - Reza Malekzadeh),Partech,reza@partech.com,Paris,,France,VC,Seed / Series A,"SaaS, Enterprise, AI",https://linkedin.com/in/rezamalekzadeh,https://partechpartners.com,Yes,$200K-$20M,,,None,Not Contacted,High,$2.5B,,Yes,,,,,,,,GP,,,,,14-30 days,,,2,LinkedIn,,,GP at Partech. Source: partechpartners.com,Medium,,,,5
Peak (Istanbul),Peak (Zynga-acquired),info@peak.com,Istanbul,,Turkey,CVC / Angel,Seed / Series A,"Gaming, AI, Consumer",https://linkedin.com/company/peakgames,https://peak.com,No,$100K-$1M,,,None,Not Contacted,Medium,,Peak Games founders active as angels post-Zynga acquisition. Source: LinkedIn,No,3,,,,,,,Angel,,,,,7-14 days,,,2,LinkedIn,,,Peak Games team angel investing. Source: LinkedIn,Medium,,,,5
Peter Balogh,Day One Capital,peter@dayonecapital.com,Budapest,,Hungary,VC,Pre-seed / Seed,"SaaS, Fintech, AI",https://linkedin.com/in/peterbalogh,https://dayonecapital.com,Yes,$100K-$500K,,,None,Not Contacted,Medium,$30M,,No,3,,,,,,,GP,,,,,7-14 days,,,2,LinkedIn,,,Hungarian seed VC. Source: dayonecapital.com,Medium,,,Check master DB,5
Peter Flint,,pete@nfx.com,,,,VC,,"Real Estate, Proptech, AI",https://www.linkedin.com/in/peteflint/,,,,,,None,Not Contacted,,,,Sometimes,3,NFX content: nfx.com/post | Network effects essays | Trulia founding story,,Duplicate,Same email in rows: 11933,,GP / Decision Maker,,"At NFX, he's publicly stated he invests in companies with 'network effects' — NFX has published an entire taxonomy of network effect types at nfx.com. Reference the specific type of network effect your company has. He co-founded Trulia.",,,,,,3,Blog,No network effects — NFX has published taxonomy of network effect types; Not a marketplace or platform [Source: nfx.com/post],"Best: Q1 (Jan-Mar). Reference specific NFX essay relevant to your company. Avoid: Aug, late Dec. [Source: industry standard]",,"NFX. Trulia co-founder. Known for network effects expertise. [Source: General community reputation based on public founder testimonials, blog posts, podcast interviews, and published accounts. Not independently verified.]",Medium,,,,5
Pi Ventures (Dublin),Pi Ventures Ireland,info@piventures.ie,Dublin,,Ireland,VC,Pre-seed / Seed,"SaaS, AI, Consumer",https://linkedin.com/company/piventures,https://piventures.ie,Yes,$100K-$500K,,,None,Not Contacted,Low,$20M,,No,2,,,,,,,GP,,,,,7-14 days,,,2,LinkedIn,,,Irish seed fund. Source: piventures.ie,Medium,,,,5
Pitango VC,Pitango VC,,Herzliya,,Israel,VC,Seed / Series A / Growth,Technology / Enterprise / Health / Deep Tech,https://www.linkedin.com/company/pitango-venture-capital/,https://www.pitango.com,Yes,$1M-$30M,https://www.pitango.com/contact-us/,,,Not Contacted,,$2.8B,,,,,,,,,,,,,,,,,,,,,,,High,,,,5
Plug and Play Health,Plug and Play Health,,Sunnyvale,California,United States,Accelerator,Seed,"HealthTech, MedTech",https://www.linkedin.com/company/plug-and-play-tech-center/,https://www.plugandplaytechcenter.com/health/,Yes,$25K-$500K,https://www.plugandplaytechcenter.com/join/,,None,Not Contacted,,,,,,,,,,,,,,,,,,,,,,,,,Medium,,,,5
PreSeed Ventures,PreSeed Ventures,info@preseed.dk,Copenhagen,,Denmark,VC,Pre-seed / Seed,"SaaS, Health, AI",https://linkedin.com/company/preseed-ventures,https://preseed.dk,Yes,$100K-$500K,,,None,Not Contacted,Medium,$50M,,No,3,,,,,,,GP,,,,,7-14 days,,,2,LinkedIn,,,Danish pre-seed fund. Source: preseed.dk,Medium,,,,5
Push Ventures,Push Ventures,info@push.ventures,Vienna,,Austria,VC,Pre-seed / Seed,"SaaS, AI, Consumer",https://linkedin.com/company/push-ventures,https://push.ventures,Yes,$50K-$300K,,,None,Not Contacted,Low,$15M,,No,2,,,,,,,GP,,,,,7-14 days,,,1,LinkedIn,,,Austrian micro VC. Source: push.ventures,Medium,,,,5
Raffi Kamber,Singular,raffi@singular.vc,Paris,,France,VC,Seed / Series A,Deep Tech / AI,https://www.linkedin.com/in/raffikamber/,https://www.singular.vc,Yes,$1M-$10M,,,,Not Contacted,,$425M,,,,,,,,,,,,,,,,,,,,,,,High,,,,5
Rahul Chandra,Kalaari Capital,rahul@kalaari.com,Bangalore,,India,VC,Series A / Series B,Health / Consumer,https://www.linkedin.com/in/rahulchandra/,https://www.kalaari.com,Yes,$1M-$10M,,,,Not Contacted,,$650M,,,,,,,,,,,,,,,,,,,,,,,High,,,,5
Ram Parameswaran,Altimeter Capital,,Menlo Park,California,United States,VC,"Series A, Growth","AI, Consumer, SaaS, Cloud",https://linkedin.com/in/ramparameswaran,https://altimetercap.com,Yes,$10M-$100M+,,,,,Tier 1,$3B+,,Yes,,,Medium (3-6 weeks),Removed — Dead Domain,REMOVED — dead domain: ram@altimetercap.com,"Coatue, Tiger Global, a16z, Sequoia, D1 Capital",GP / Decision Maker,,,,,2-3 weeks,14-30 days,,,,,"Best: Q1 (Jan-Mar, new fund year, deploying capital). Avoid: Aug, late Dec (vacation). [Source: industry standard]",Source: Investor's documented medium response time in database,,,,,,5
Ravi Lambah,Temasek,ravilambah@temasek.com.sg,Singapore,,Singapore,VC,,"Enterprise, Consumer, Healthcare, Fintech",https://linkedin.com/in/ravi-lambah-7b95a7a3,https://www.temasek.com.sg,,,,,None,Not Contacted,,$300B+,"Alibaba, ByteDance, Sea Limited, Grab, Hive, PayTM, Bitmain",Yes,,,Slow (2-6 months),Verified — MX Valid,,"Sequoia, GIC, Tiger Global, B Capital",GP / Decision Maker,,,Massive Singapore sovereign wealth fund. Very long process (2-6 months). Professional but bureaucratic. Source: temasek.com.sg.,,1 month+,90+ days,,,,,"Best: Q1 (Jan-Mar, new fund year, deploying capital). Avoid: Aug, late Dec (vacation). [Source: industry standard]",Source: Singapore sovereign wealth fund; very long process; temasek.com.sg,,Medium,,,,5
Remus Brett,LocalGlobe,remus@localglobe.vc,London,,United States,VC,Seed,"Deep Tech, AI, Enterprise",https://linkedin.com/in/remusbrett,https://localglobe.vc,Yes,$250K-$5M,https://www.localglobe.vc/pitch,,None,Not Contacted,,$800M,,Yes,,,,Verified — MX Valid,,"Seedcamp, Index Ventures, Balderton, Passion Capital, Mosaic Ventures",GP / Decision Maker,,,,Apply: https://www.localglobe.vc/pitch,,,,,,,"Best: Q1 (Jan-Mar, new fund year, deploying capital). Avoid: Aug, late Dec (vacation). [Source: industry standard]",,,Medium,,,,5
Reshma Sohoni,Seedcamp,reshma@seedcamp.com,London,,United States,VC,"Pre-seed, Seed","AI, Consumer, Enterprise",https://linkedin.com/in/reshmasohoni,https://seedcamp.com,Yes,$100K-$500K,https://seedcamp.com/apply/,,None,Not Contacted,,$100M,,Yes,,,,Verified — MX Valid,,"LocalGlobe, Index Ventures, Balderton, Felix Capital, Cherry Ventures",GP / Decision Maker,,,,Apply: https://seedcamp.com/apply/,,,,,,,"Best: Q1 (Jan-Mar, new fund year, deploying capital). Avoid: Aug, late Dec (vacation). [Source: industry standard]",,,Medium,,,,5
Resurge,Resurge,info@resurge.vc,London,England,United Kingdom,VC,Seed / Series A,"SaaS, AI, Enterprise",https://linkedin.com/company/resurge-vc,https://resurge.vc,Yes,$500K-$3M,,,None,Not Contacted,Medium,$50M,,No,3,,,,,,,GP,,,,,7-14 days,,,2,LinkedIn,,,UK seed VC. Source: resurge.vc,Medium,,,,5
Rock Health,Rock Health,,San Francisco,California,United States,Accelerator,Seed,"Digital Health, HealthTech",https://www.linkedin.com/company/rock-health/,https://rockhealth.com,Yes,$250K,https://rockhealth.com/apply,,None,Not Contacted,,,,,,,,,,,,,,,,,,,,,,,,,Medium,,,,5
Safa Rashtchy,https://www.crunchbase.com/person/safa-rashtchy,safa@thinkplus.vc,Palo Alto,California,United States,Angel,,"Internet, FinTech, Healthcare",https://linkedin.com/in/safa-rashtchy-7810691,http://thinkplus.vc/,,,,,None,Not Contacted,Low,,,No,,,,Verified — MX Valid,,,Solo Angel,,,,,,1-14 days,,,,,"Best: Anytime. Avoid: Holiday weeks (late Dec, early Jan). [Source: general angel pattern]",Source: Typical angel investor timeline based on published seed-stage research,,Medium,,,,5
Sam Altman,https://www.crunchbase.com/person/sam-altman,,San Francisco,California,United States,Angel/VC,"Seed, Series A","AI, Enterprise, Consumer",https://www.linkedin.com/in/unavailable/,http://blog.samaltman.com/,Sometimes,$100K-$2M,,,None,Not Contacted,Low,,,Sometimes,,,,,,"Y Combinator, Sequoia, a16z, SV Angel, Initialized Capital",GP / Decision Maker,,"He's blogged extensively at blog.samaltman.com about what he looks for in startups. He's publicly stated he values 'rate of improvement' over current state — show momentum. He's written that the best founders have a 'clarity of vision' and can explain their idea simply. Since his focus shifted to OpenAI, his personal investing has narrowed, but he still backs AI-adjacent companies.",,,,1-14 days,,,,,"Best: Q1 (Jan-Mar, new fund year, deploying capital). Avoid: Aug, late Dec (vacation). [Source: industry standard]",Source: Typical angel investor timeline based on published seed-stage research,,Medium,,,,5
Samantha Jerusalmy,Elaia Partners,samantha@elaia.com,Paris,,France,VC,Seed / Series A,Deep Tech / AI,https://www.linkedin.com/in/samanthajerusalmy/,https://www.elaia.com,Yes,$500K-$5M,,,,Not Contacted,,$400M,,,,,,,,,,,,,,,,,,,,,,,High,,,,5
Sandra Malmberg,EQT Ventures,sandra@eqtventures.com,Stockholm,,Sweden,VC,Seed / Series A,Health / Consumer,https://www.linkedin.com/in/sandramalmberg/,https://eqtventures.com,Yes,$1M-$25M,,,,Not Contacted,,$2.6B,,,,,,,,,,,,,,,,,,,,,,,High,,,,5
Simon Menashy,MMC Ventures,simon@mmcventures.com,London,England,United Kingdom,VC,Seed / Series A,"AI, Enterprise, SaaS",https://linkedin.com/in/simonmenashy,https://mmcventures.com,Yes,$500K-$5M,,,None,Not Contacted,High,$400M,,Yes,,,,,,,,Partner,,,,,14-30 days,,,3,LinkedIn,,,Partner at MMC Ventures. Source: mmcventures.com,Medium,,,,5
Siraj Khaliq,Atomico,siraj@atomico.com,London,,UK,VC,Series A / Series B / Growth,AI / Deep Tech,https://www.linkedin.com/in/sirajkhaliq/,https://www.atomico.com,Yes,$5M-$50M,,,,Not Contacted,,$4.7B,,,,,,,,,,,,,,,,,,,,,,,High,,,,5
Skyfall Ventures,Skyfall Ventures,info@skyfallventures.com,Helsinki,,Finland,VC,Pre-seed / Seed,"Gaming, AI, Consumer",https://linkedin.com/company/skyfall-ventures,https://skyfallventures.com,Yes,$100K-$500K,,,None,Not Contacted,Medium,$30M,,No,3,,,,,,,GP,,,,,7-14 days,,,2,LinkedIn,,,Finnish gaming/AI seed fund. Source: skyfallventures.com,Medium,,,,5
Skylab (by XTC),XTC / Skylab,,San Francisco,California,United States,Accelerator,Pre-seed,"Deep Tech, Climate, AI",https://www.linkedin.com/company/xtc-global/,https://www.xtc.com,No,Mentorship + Demo Day,https://www.xtc.com/apply,,None,Not Contacted,,,,,,,,,,,,,,,,,,,,,,,,,Medium,,,,5
Sophie Bakalar,Collaborative Fund,sophie@collaborativefund.com,New York,NY,US,VC,Seed / Series A,Sustainability / Food / Health / Cities,https://www.linkedin.com/in/sophiebakalar/,https://www.collaborativefund.com,Yes,$500K-$5M,,,,Not Contacted,,$300M,,,,,,,,,,,,,,,,,,,,,,,High,,,,5
Speedinvest,Speedinvest,,Vienna,,Austria,VC,Pre-Seed / Seed / Series A,Deep Tech / Fintech / Industrial / Health,https://www.linkedin.com/company/speedinvest/,https://www.speedinvest.com,Yes,$500K-$5M,https://www.speedinvest.com/contact,,,Not Contacted,,$500M,,,,,,,,,,,,,,,,,,,,,,,High,,,,5
Spencer Sheridan,Firstminute Capital,spencer@firstminute.capital,London,England,United Kingdom,VC,Seed,"AI, SaaS, Consumer",https://linkedin.com/in/spencerfirstminute,https://firstminute.capital,Yes,$250K-$2M,,,None,Not Contacted,High,$200M,,No,,,,,,,,GP,,,,,7-14 days,,,2,LinkedIn,,,GP at Firstminute Capital. Source: firstminute.capital,Medium,,,,5
Sudhir Sethi,Chiratae Ventures,sudhir@chiratae.com,Bangalore,,India,VC,Seed / Series A / Growth,Technology / Healthcare,https://www.linkedin.com/in/sudhirsethi/,https://www.chiratae.com,Yes,$1M-$20M,,,,Not Contacted,,$1.2B,,,,,,,,,,,,,,,,,,,,,,,High,,,,5
Sumeet Vaidya,Crafting,sumeet@crafting.dev,San Francisco,California,United States,Other,,AI,https://www.linkedin.com/in/sumeet-vaidya/,https://www.crafting.dev/,,,,,None,Not Contacted,Medium,,,Unknown,,,,Verified — MX Valid,,,,,,,,,,,,,,,,,Medium,,,,5
Superangel,Superangel,info@superangel.io,Tallinn,,Estonia,VC / Angel Group,Pre-seed / Seed,"SaaS, AI, Fintech",https://linkedin.com/company/superangelio,https://superangel.io,Yes,$50K-$250K,,,None,Not Contacted,Medium,$15M,,No,3,,,,,,,Fund,,,,,7-14 days,,,2,LinkedIn,,,Estonian micro VC/angel fund. Source: superangel.io,Medium,,,,5
Susa Ventures,Susa Ventures,,San Francisco,California,United States,VC,"Pre-seed, Seed","AI, Fintech, Consumer, SaaS",,https://www.susaventures.com,,,,,,Not Contacted,,$90M,,,,,,,,,,,"Writes first checks. Active seed investor. [Source: Dave Lambert LinkedIn post listing active seed investors, March 2025]",,,,,,,,,,,,Medium,,,,5
Svana Helen Bjornsdottir,Crowberry Capital,svana@crowberry.co,Reykjavik,,Iceland,VC,Pre-seed / Seed,"SaaS, Consumer, Impact",https://linkedin.com/in/svanabjornsdottir,https://crowberry.co,Yes,$50K-$500K,,,None,Not Contacted,Medium,$25M,,No,3,,,,,,,GP,,,,,7-14 days,,,2,LinkedIn,,,Icelandic seed fund. Source: crowberry.co,Medium,,,,5
Swanlaab Venture Factory,Swanlaab,info@swanlaab.com,Madrid,,Spain,VC,Seed / Series A,"SaaS, Fintech, Health",https://linkedin.com/company/swanlaab,https://swanlaab.com,Yes,$200K-$2M,,,None,Not Contacted,Medium,$60M,,No,3,,,,,,,GP,,,,,7-14 days,,,2,LinkedIn,,,Spanish VC. Source: swanlaab.com,Medium,,,,5
Techstars AI (powered by Microsoft),Techstars AI,,San Francisco,California,United States,Accelerator,"Pre-seed, Seed","AI, ML, Data",https://www.linkedin.com/company/techstars/,https://www.techstars.com/accelerators,Yes,$20K-$120K,https://www.techstars.com/accelerators,,None,Not Contacted,,,,,,,,,,,,,,,,,,,,,,,,,Medium,,,,5
Techstars Healthcare (Cedars-Sinai),Techstars Healthcare,,Los Angeles,California,United States,Accelerator,"Pre-seed, Seed","Digital Health, MedTech",https://www.linkedin.com/company/techstars/,https://www.techstars.com/accelerators/healthcare,Yes,$20K-$120K,https://www.techstars.com/accelerators,,None,Not Contacted,,,,,,,,,,,,,,,,,,,,,,,,,Medium,,,,5
Tera Ventures (additional - Rain Rannu),Tera Ventures,rain@tera.vc,Tallinn,,Estonia,VC,Pre-seed / Seed,"SaaS, Fintech, AI",https://linkedin.com/in/rainrannu,https://tera.vc,Yes,$100K-$1M,,,None,Not Contacted,High,$55M,,No,,,,,,,,GP,,,,,7-14 days,,,2,LinkedIn,,,GP at Tera Ventures. Source: tera.vc,Medium,,,,5
Thomas Dübendorfer,Wingman Ventures,thomas@wingman.vc,Zurich,,Switzerland,VC,Pre-seed / Seed,"SaaS, AI, Climate",https://linkedin.com/in/thomasdubendorfer,https://wingman.vc,Yes,$100K-$1M,,,None,Not Contacted,Medium,$30M,,No,3,,,,,,,GP,,,,,7-14 days,,,2,LinkedIn,,,Swiss seed fund. Source: wingman.vc,Medium,,,,5
Thomas Haught,Sequoia Family Office,thaught@sequoia-financial.com,,Ohio,United States,VC,,"AI, Enterprise, Consumer, Health, Fintech",https://linkedin.com/in/thomas-haught-400577125,https://www.sequoia-financial.com,,,,,None,Not Contacted,,$10B+,"Airbnb, Stripe, DoorDash, Zoom, Unity, Figma, Klarna, Apple, Google, WhatsApp",Yes,,,Medium (3-6 weeks),Verified — MX Valid,,"a16z, Accel, Lightspeed, Tiger Global, Y Combinator, Klarna, Stripe",GP / Decision Maker,,,,,2-3 weeks,14-30 days,,,,"Can't answer 'why now?'; Team not strong enough; Market timing wrong; Incremental idea [Source: Sequoia pitch template, multiple books]",Best: Q1 (Jan-Mar). Note: Moritz largely retired from active Sequoia investing. [Source: industry standard],Source: Known scout → partner → Monday meeting pipeline; published founder accounts,,Medium,,,,5
Tom Sheridan,Ascension Ventures,tom@ascensionventures.com,London,England,United Kingdom,VC,Pre-seed / Seed,"Impact, Diverse Founders, Underserved Markets",https://linkedin.com/in/tomascension,https://ascensionventures.com,Yes,$50K-$250K,,,None,Not Contacted,Medium,$30M,,No,3,,,,,,,Partner,,,,,7-14 days,,,3,Twitter/X,,,Impact-driven seed fund. Fair By Design partner. Source: ascensionventures.com,Medium,,,,5
Tom Wilson,Seedcamp,tom@seedcamp.com,London,,United States,VC,"Pre-seed, Seed","Consumer, Enterprise, AI",https://linkedin.com/in/tomwilson,https://seedcamp.com,Yes,$100K-$500K,https://seedcamp.com/apply/,,None,Not Contacted,,$100M,,Yes,,,,Verified — MX Valid,,"LocalGlobe, Index Ventures, Balderton, Felix Capital, Cherry Ventures",GP / Decision Maker,,,,Apply: https://seedcamp.com/apply/,,,,,,,"Best: Q1 (Jan-Mar, new fund year, deploying capital). Avoid: Aug, late Dec (vacation). [Source: industry standard]",,,Medium,,,,5
