Matias de Tezanos,Matias de Tezanos,matias@peoplefund.com,,,,Angel,,"Consumer, Food & Bev, HEalth",https://www.linkedin.com/in/matiasdetezanos/,https://www.matiasdetezanos.com,,,,,None,Not Contacted,,,,No,,,,Domain Mismatch,Email domain (peoplefund.com) != fund domain (matiasdetezanos.com),,Solo Angel,,,,,,1-14 days,,,,,"Best: Anytime. Avoid: Holiday weeks (late Dec, early Jan). [Source: general angel pattern]",Source: Typical angel investor timeline based on published seed-stage research,,Medium,,,,3
Matt Garratt,Salesforce Ventures,,,,,CVC,"Series A, Series B+, Growth","Enterprise, SaaS, AI, Cloud",,https://www.salesforce.com/company/ventures/,Yes,$5M-$50M,No public form — warm intro only,,None,Not Contacted,,$5B+,,Yes,,,Slow (2-6 months),,,"Sequoia, a16z, Accel, Emergence Capital, Insight Partners",GP / Decision Maker,,,,,1 month+,60-90 days,,,,,"Best: Q1 (Jan-Mar, new fund year, deploying capital). Avoid: Aug, late Dec (vacation). [Source: industry standard]",Source: Investor's documented slow response time in database,,Low,,,,3
Maximilian A. Bade,,maximilian@nucleus-capital.com,,,,VC,,"Food & bev, Consumer, Health",https://linkedin.com/in/maximilian-bade,https://nucleus-capital.com/,,,,,None,Not Contacted,,,,Sometimes,,,,Verified — MX Valid,,,Partner,,,,,,,,,,,"Best: Q1 (Jan-Mar, new fund year, deploying capital). Avoid: Aug, late Dec (vacation). [Source: industry standard]",,,Medium,,,,3
Meagan Loyst,Gen Z VCs (Founder) / Angel,,New York,New York,United States,Angel,Pre-seed / Seed,"Creator Economy, Social Platforms, AI, Consumer, Mental Health",https://www.linkedin.com/in/meaganloyst/,https://www.genz.vc,,,,,,,High,,,No,,,,,,,Solo Angel,,,,,,1-14 days,,,,,"Best: Anytime. Avoid: Holiday weeks (late Dec, early Jan). [Source: general angel pattern]",Source: Typical angel investor timeline based on published seed-stage research,,Medium,,,,3
Melanie (Mel) Strong,NEXT VENTURES,,,,,VC,"Seed, Series A","Health, Whole-person care, Prevention, Root causes of poor health outcomes",,,,,,,,Not Contacted,,,,,,,,,,,GP / Decision Maker,,"Founding Partner @ NEXT VENTURES. Clear thesis: fix the root causes of poor health outcomes, not just symptoms. Backs whole-person care solutions connecting upstream prevention with downstream delivery. Improving outcomes AND lowering costs. [Source: healthtech investor list, March 2025]",,,,,,,,,,,,High,,,,3
Melanie Strong,,melanie@nextventures.com,,,,VC,,"B2C, Applications, Consumer, Consumer Goods, Digital Health, E-Commerce, Health Care, SaaS, Sports, Platforms",https://linkedin.com/in/melanie-strong,https://nextventures.com/,,,,,None,Not Contacted,,,,Sometimes,,,,Verified — MX Valid,,,Partner,,,,,,,,,,,"Best: Q1 (Jan-Mar, new fund year, deploying capital). Avoid: Aug, late Dec (vacation). [Source: industry standard]",,,Medium,,,,3
Michael Hanley,,mhanley@mhcpafirm.com,,,,VC,,"Foodtech, Clean tech, Sustainability",https://www.linkedin.com/in/hanley/,http://www.hanfieldventures.com/,,,,,None,Not Contacted,,,,Sometimes,,,,Domain Mismatch,Email domain (mhcpafirm.com) != fund domain (hanfieldventures.com),,Partner,,,,,,,,,,,"Best: Q1 (Jan-Mar, new fund year, deploying capital). Avoid: Aug, late Dec (vacation). [Source: industry standard]",,,Medium,,,,3
Michael Majors,Datapoint Capital,mmajors@datapointcapital.com,,,,VC,,"Enterprise, Data, AI",,https://www.datapointcapital.com,,,,,None,Not Contacted,,$250M,,Yes,,,,Duplicate,Same email in rows: 4149,,GP / Decision Maker,,,,,,,,,,,"Best: Q1 (Jan-Mar, new fund year, deploying capital). Avoid: Aug, late Dec (vacation). [Source: industry standard]",,,Low,,,,3
Microsoft for Startups,Microsoft for Startups,,Redmond,Washington,United States,Accelerator,"Seed, Series A","Cloud, AI, Enterprise, SaaS",https://www.linkedin.com/showcase/microsoftforstartups/,https://www.microsoft.com/en-us/startups,No,$150K Azure credits,https://www.microsoft.com/en-us/startups/apply,,None,Not Contacted,,,,,,,,,,,,,,,,,,,,,,,,,Medium,,,,3
Mihir Bhanot,Mihir Bhanot,bhanot@amazon.com,,,,Angel,,"SaaS, Ventures for Good, Clean Technology, Mobile, Healthcare, Information Technology, Digital Media",https://www.linkedin.com/in/mihirbhanot/,https://www.mihirbhanot.com,,,,,None,Not Contacted,,,,No,,,,Domain Mismatch,Email domain (amazon.com) != fund domain (mihirbhanot.com),,Solo Angel,,,,,,1-14 days,,,,,"Best: Anytime. Avoid: Holiday weeks (late Dec, early Jan). [Source: general angel pattern]",Source: Typical angel investor timeline based on published seed-stage research,,Medium,,,,3
Mike Lazerow,Angel / Advisor,,New York,New York,United States,Angel,Seed / Series A,"AI, Social Platforms, Digital Media, Martech, Creator Economy",https://www.linkedin.com/in/mikelazerow/,,,,,,,,High,,,No,,,,,,,Solo Angel,,,,,,1-14 days,,,,,"Best: Anytime. Avoid: Holiday weeks (late Dec, early Jan). [Source: general angel pattern]",Source: Typical angel investor timeline based on published seed-stage research,,Medium,,,,3
"Milena Nikolova, CFA",Aera VC,,,,,VC,"Pre-seed, Seed","Tech, Sustainability, Food, Healthcare",https://www.linkedin.com/in/milena-nikolova-vatchkova/,https://www.aera.vc/,Yes,$100K-$1M,,,None,Not Contacted,,$30M,,Yes,,,,Removed — Dead Domain,REMOVED — dead domain: milena@aera.vc,,GP / Decision Maker,,,,,,14-30 days,,,,,"Best: Q1 (Jan-Mar, new fund year, deploying capital). Avoid: Aug, late Dec (vacation). [Source: industry standard]",Source: Pre-seed/seed; structured; aera.vc,,Medium,,,,3
Miles Lasater,Miles Lasater,Miles@mileslasater.com,,,,Angel,,"SaaS, Software, Health Care, B2B, E-commerce, Early-Stage",https://www.linkedin.com/in/mileslasater/,https://www.mileslasater.com,,,,,None,Not Contacted,,,,No,,,,Verified — MX Valid,,,Solo Angel,,,,,,1-14 days,,,,,"Best: Anytime. Avoid: Holiday weeks (late Dec, early Jan). [Source: general angel pattern]",Source: Typical angel investor timeline based on published seed-stage research,,Medium,,,,3
Mohammed Abdulmohsen Al-Kharafi,M.A. Kharafi & Sons,hazmi@makharafi.net,Phoenix,Arizona,United States,Family Office,,"Healthcare, Medical",https://linkedin.com/in/mohammed-al-kharafi-6a96ab57,https://www.makharafi.net,,,,,None,Not Contacted,,,,Sometimes,,,,Verified — MX Valid,,,Family Office Principal,,,,,,30-60 days,,,,,"Best: After a liquidity event in their portfolio. Q1 (new budgets). Avoid: Q4 (budget freeze), holiday weeks. [Source: FO behavior pattern]",Source: Typical family office relationship-driven timeline,,Medium,,,,3
Molly Strange,,strangem@amazon.com,Seattle,Washington,United States,Angel,,"E-Commerce, Cloud, AI, Consumer",https://linkedin.com/in/mollystrange,,,,,,None,Not Contacted,,,,No,,,,Verified — MX Valid,No fund website to cross-reference,,Solo Angel,,,,,,1-14 days,,,,,"Best: Anytime. Avoid: Holiday weeks (late Dec, early Jan). [Source: general angel pattern]",Source: Typical angel investor timeline based on published seed-stage research,,Medium,,,,3
Morgan DeBaun,Blavity (CEO) / Angel,,Washington,DC,United States,Angel,Pre-seed / Seed,"Digital Media, Creator Economy, AI, Social Platforms, Media/Entertainment",https://www.linkedin.com/in/morgandebaun/,https://www.blavity.com,,,,,,,High,,,No,,,,,,,Solo Angel,,,,,,1-14 days,,,,,"Best: Anytime. Avoid: Holiday weeks (late Dec, early Jan). [Source: general angel pattern]",Source: Typical angel investor timeline based on published seed-stage research,,Medium,,,,3
Morgan Housel,,Morgan@collaborativefund.com,,,,VC,,"Consumer Goods, Consumer Services, Internet, Impact",https://www.linkedin.com/in/morgan-housel-5b473821/,http://collaborativefund.com/,,,,,None,Not Contacted,,,,Sometimes,,,,Verified — MX Valid,,,Partner,,,,,,,,,,,"Best: Q1 (Jan-Mar, new fund year, deploying capital). Avoid: Aug, late Dec (vacation). [Source: industry standard]",,,Medium,,,,3
Morgan S,,Morgan@manaventures.vc,,,,VC,,"VR/AR, Gaming, Software, AI, Blockchain, Consumer Goods",https://www.linkedin.com/in/morganschwanke/,http://manaventures.vc/,,,,,None,Not Contacted,,,,Sometimes,,,,Duplicate,Same email in rows: 498,,Partner,,,,,,,,,,,"Best: Q1 (Jan-Mar, new fund year, deploying capital). Avoid: Aug, late Dec (vacation). [Source: industry standard]",,,Medium,,,,3
Nadine Torbey,Nadine Torbey,nadine@albion.vc,,,,Angel,,"Fintech, Martech, Digital Health, Cybersecurity, Predictive Analytics",https://www.linkedin.com/in/nadine-torbey-07006854/,https://www.nadinetorbey.com,,,,,None,Not Contacted,,,,No,,,,Domain Mismatch,Email domain (albion.vc) != fund domain (nadinetorbey.com),,Solo Angel,,,,,,1-14 days,,,,,"Best: Anytime. Avoid: Holiday weeks (late Dec, early Jan). [Source: general angel pattern]",Source: Typical angel investor timeline based on published seed-stage research,,Medium,,,,3
Nael Rasamny,,nael@outboundventures.com,,,,VC,,"Consumer Electronics, Consumer Goods, E-Commerce, Marketplaces, Real Estate, Media and Entertainment, Fintech, Lifestyle and Wellness, B2C",https://www.linkedin.com/in/naelrasamny/,http://outboundventures.com/,,,,,None,Not Contacted,,,,Sometimes,,,,Verified — MX Valid,,,Partner,,,,,,,,,,,"Best: Q1 (Jan-Mar, new fund year, deploying capital). Avoid: Aug, late Dec (vacation). [Source: industry standard]",,,Medium,,,,3
Nancy Galarneau,"Cabot-Wellington, LLC",ngalarneau@cabwel.com,,Massachusetts,United States,Family Office,,"Enterprise, Health, Consumer, Tech",https://linkedin.com/in/nancy-galarneau-3358351a,https://www.cabwel.com,,,,,None,Not Contacted,,,,Sometimes,,,,Verified — MX Valid,,"Sequoia, Kleiner Perkins, Lightspeed, GV, Accel",Family Office Principal,,,,,,30-60 days,,,,,"Best: After a liquidity event in their portfolio. Q1 (new budgets). Avoid: Q4 (budget freeze), holiday weeks. [Source: FO behavior pattern]",Source: Typical family office relationship-driven timeline,,Medium,,,,3
Naomi Kokubo,Naomi Kokubo,naomi@foundersspace.com,,,,Angel,,"Cleantech, E-commerce, Mobile, Consumer Internet, Enterprise Software, AI, Mobile Commerce",https://www.linkedin.com/in/kokubo/,https://www.naomikokubo.com,,,,,None,Not Contacted,,,,No,,,,Domain Mismatch,Email domain (foundersspace.com) != fund domain (naomikokubo.com),,Solo Angel,,,,,,1-14 days,,,,,"Best: Anytime. Avoid: Holiday weeks (late Dec, early Jan). [Source: general angel pattern]",Source: Typical angel investor timeline based on published seed-stage research,,Medium,,,,3
Narendra Rocherolle,Narendra Rocherolle,narendra@thestartproject.com,,,,Angel,,"Health, Fitness, Consumer",https://linkedin.com/in/narenpublic,https://narendrarocherolle.com,,,,,None,Not Contacted,,,,No,,,,Domain Mismatch,Email domain (thestartproject.com) != fund domain (narendrarocherolle.com),,Solo Angel,,,,,,1-14 days,,,,,"Best: Anytime. Avoid: Holiday weeks (late Dec, early Jan). [Source: general angel pattern]",Source: Typical angel investor timeline based on published seed-stage research,,Medium,,,,3
Natalie Fratto,Ulu Ventures / Angel,,New York,New York,United States,VC,Pre-seed / Seed,"AI, Future of Work, Creator Economy, Digital Media",https://www.linkedin.com/in/nataliefratto/,,,,,,,,Medium,$50M,,Sometimes,,,,,,,Partner,,,,,,,,,,,"Best: Q1 (Jan-Mar, new fund year, deploying capital). Avoid: Aug, late Dec (vacation). [Source: industry standard]",,,Medium,,,,3
Natasha Pearl,Aston Pearl,npearl@astonpearl.com,New York,New York,United States,Family Office,,"AI, SaaS, Consumer, Enterprise",https://linkedin.com/in/natasha-pearl-46b21aa,https://www.astonpearl.com,,,,,None,Not Contacted,,,,Sometimes,,,,Verified — MX Valid,,,Family Office Principal,,,,,,30-60 days,,,,"Non-technical co-founding team; No raw talent and determination; Too late stage for Pear [Source: pear.vc/blog, Stanford talks]","Best: Apply to Pear Fellowship — rolling applications. Q1 is best (new fund year). Avoid: Aug, late Dec. [Source: pear.vc, industry standard]",Source: Typical family office relationship-driven timeline,,Medium,,,,3
Neal Berger,Eagle's View Asset Management LLC,nberger@evhedge.com,New York,New York,United States,Family Office,,"Enterprise, Health, Consumer, Tech",https://linkedin.com/in/neal-berger-972291,https://www.efoholdings.net,,,,,None,Not Contacted,,,,Sometimes,,,,Domain Mismatch,Email domain (evhedge.com) != fund domain (efoholdings.net),"Sequoia, Kleiner Perkins, Lightspeed, GV, Accel",Family Office Principal,,,,,,30-60 days,,,,,"Best: After a liquidity event in their portfolio. Q1 (new budgets). Avoid: Q4 (budget freeze), holiday weeks. [Source: FO behavior pattern]",Source: Typical family office relationship-driven timeline,,Medium,,,,3
Neal Bhadkamkar,,neal_bhadkamkar@monitorventures.com,,,United States,Angel,,"Enterprise, Health, Consumer, Tech",https://linkedin.com/in/neal-bhadkamkar-b501051,,,,,,None,Not Contacted,,,,No,,,,Verified — MX Valid,No fund website to cross-reference,"Sequoia, Kleiner Perkins, Lightspeed, GV, Accel",Solo Angel,,,,,,1-14 days,,,,,"Best: Anytime. Avoid: Holiday weeks (late Dec, early Jan). [Source: general angel pattern]",Source: Typical angel investor timeline based on published seed-stage research,,Medium,,,,3
Neal Mody,,neal@zoiccapital.com,Seattle,Washington,United States,Angel,,"Enterprise, Health, Consumer, Tech",https://linkedin.com/in/nealmody,,,,,,None,Not Contacted,,,,No,,,,Verified — MX Valid,No fund website to cross-reference,"Sequoia, Kleiner Perkins, Lightspeed, GV, Accel",Solo Angel,,,,,,1-14 days,,,,,"Best: Anytime. Avoid: Holiday weeks (late Dec, early Jan). [Source: general angel pattern]",Source: Typical angel investor timeline based on published seed-stage research,,Medium,,,,3
Neeraj Berry,Neeraj Berry,neerajberry@gmail.com,,,,Angel,,"Agnostic, B2B, B2C, Consumer, Consumer Goods, E-Commerce, Education, Food and Beverage, Underrepresented, Sustainability, Retail, Real Estate, Marketplaces, Logistics, Consumer Services, Agriculture, Cannabis",https://www.linkedin.com/in/neerajberry/,https://www.neerajberry.com,,,,,None,Not Contacted,,,,No,,,,Personal Email — MX Valid,,,Solo Angel,,,,,,1-14 days,Fund thesis includes underrepresented/diverse founders. Source: fund investment thesis,,,,"Best: Anytime. Avoid: Holiday weeks (late Dec, early Jan). [Source: general angel pattern]",Source: Typical angel investor timeline based on published seed-stage research,,Medium,,,,3
Nick Jackson,,jackson@themendotagroup.com,,,,VC,,"Software, HealthTech, TMT",https://www.linkedin.com/in/nick-jackson-1237a33/,,,,,,None,Not Contacted,,,,Sometimes,,,,Verified — MX Valid,No fund website to cross-reference,,Partner,,,,,,,,,,,"Best: Q1 (Jan-Mar, new fund year, deploying capital). Avoid: Aug, late Dec (vacation). [Source: industry standard]",,,Medium,,,,3
Parker McKee,,Parker@pillar.vc,,,,VC,,"AI, SaaS, Consumer",https://www.linkedin.com/in/parker-mckee-491118a7/,https://pillar.vc/,,,,,None,Not Contacted,,,,Sometimes,,,,Verified — MX Valid,,,Partner,,,,,,,,,,,"Best: Q1 (Jan-Mar, new fund year, deploying capital). Avoid: Aug, late Dec (vacation). [Source: industry standard]",,,Medium,,,,3
Patrick Mulach,,pmulach@polarispartners.com,,,,VC,,"Health Care, BioTech, Software, Medical, Therapeudics, Big Data, Pharmaceutical, MedTech, Enterprise, FinTech",https://www.linkedin.com/in/patrick-mulach-75712410a/,http://polarispartners.com/,,,,,None,Not Contacted,,,,Sometimes,,,,Verified — MX Valid,,,Partner,,,,,,,,,,,"Best: Q1 (Jan-Mar, new fund year, deploying capital). Avoid: Aug, late Dec (vacation). [Source: industry standard]",,,Medium,,,,3
Paul Greenwell,,pgreenwell@lkcm.com,Fort Worth,Texas,United States,Angel,,"Clean Tech, Sustainability",https://linkedin.com/in/paul-greenwell-29b08b44,,,,,,None,Not Contacted,,,,No,,,,Verified — MX Valid,No fund website to cross-reference,,Solo Angel,,,,,,1-14 days,,,,,"Best: Anytime. Avoid: Holiday weeks (late Dec, early Jan). [Source: general angel pattern]",Source: Typical angel investor timeline based on published seed-stage research,,Medium,,,,3
Paul-François Fournier,Bpifrance — Innovation Division,,Paris,,France,Sovereign Wealth Fund,"Seed, Early Stage, Growth","Technology, AI, Deep Tech",https://www.linkedin.com/in/paul-francois-fournier/,https://www.bpifrance.fr,Yes,$1M-$50M,,,,Not Contacted,,€35B,,,,,,,,,,,,,,,,,,,,,,,,,,,3
Pearl Manieri,Najarian Family Office,pearlynk09@gmail.com,,Illinois,United States,Family Office,,"AI, SaaS, Consumer, Enterprise",https://linkedin.com/in/pearlyn-madrid-17a8681,https://www.najarianfamilyoffice.com,,,,,None,Not Contacted,,,,Sometimes,,,,Personal Email — MX Valid,,,Family Office Principal,,,,,,30-60 days,,,,,"Best: After a liquidity event in their portfolio. Q1 (new budgets). Avoid: Q4 (budget freeze), holiday weeks. [Source: FO behavior pattern]",Source: Typical family office relationship-driven timeline,,Medium,,,,3
Peng Cheng,,peng.cheng@svtechventures.com,,,,VC,,"Fintech, Robotics, Digital AI",https://www.linkedin.com/in/peng-cheng-9b97a211/,,,,,,None,Not Contacted,,,,Sometimes,,,,Verified — MX Valid,No fund website to cross-reference,,Partner,,,,,,,,,,,"Best: Q1 (Jan-Mar, new fund year, deploying capital). Avoid: Aug, late Dec (vacation). [Source: industry standard]",,,Medium,,,,3
Portfolia,,,San Francisco,,United States,Angel Group,"Seed, Series A","FemTech, Consumer, Health, AgeTech",,https://www.portfolia.com,Sometimes,$50K-$200K,,,None,Not Contacted,,,,No,,,,,,,Solo Angel,,,,,,1-14 days,Fund thesis includes female/women founders. Source: fund investment thesis,,,,"Best: Anytime. Avoid: Holiday weeks (late Dec, early Jan). [Source: general angel pattern]",Source: Typical angel investor timeline based on published seed-stage research,,Medium,,,,3
Pradyumna Agrawal,Temasek Holdings — Vertex Ventures,,Singapore,,Singapore,Sovereign Wealth Fund,"Early Stage, Growth","Technology, AI, Blockchain",https://www.linkedin.com/in/pradyumnaagrawal/,https://www.temasek.com.sg,Yes,$10M-$100M,,,,Not Contacted,,$382B,,,,,,,,,,,,,,,,,,,,,,,,,,,3
Precious Oyelade,,"precious@seedcamp.com,",London,England,United Kingdom,VC,,"AI, Consumer, Enterprise, Cloud",https://linkedin.com/in/precious-oyelade,,,,,,None,Not Contacted,,,,Sometimes,,,,Malformed,Multiple emails in field,,Partner,,,,,,,,,,,"Best: Q1 (Jan-Mar, new fund year, deploying capital). Avoid: Aug, late Dec (vacation). [Source: industry standard]",,,Medium,,,,3
Ramsey Chapin,Ramsey Chapin,ramsey@thatkey.com,,,,Angel,,"Mobile, Health and Wellness, Media",https://www.linkedin.com/in/ramseychapin/,https://www.ramseychapin.com,,,,,None,Not Contacted,,,,No,,,,Domain Mismatch,Email domain (thatkey.com) != fund domain (ramseychapin.com),,Solo Angel,,,,,,1-14 days,,,,,"Best: Anytime. Avoid: Holiday weeks (late Dec, early Jan). [Source: general angel pattern]",Source: Typical angel investor timeline based on published seed-stage research,,Medium,,,,3
Randy Norton,Green Mesa Capital,randy@greenmesacapital.com,,Nevada,United States,Family Office,,"Clean Tech, Sustainability",https://linkedin.com/in/randycnorton,https://www.GreenMesaCapital.com,,,,,None,Not Contacted,,,,Sometimes,,,,Verified — MX Valid,,"a16z, Sequoia, Founders Fund, General Catalyst",Family Office Principal,,,Deep tech and frontier companies. Source: A Capital thesis.,,,14-30 days,,,,,"Best: After a liquidity event in their portfolio. Q1 (new budgets). Avoid: Q4 (budget freeze), holiday weeks. [Source: FO behavior pattern]",Source: Deep tech focus; structured process,,Medium,,,,3
Rich Kleiman,,info@thirtyfiveventures.com,,,,VC,,"Software, Fintech, Healthcare, Financial Services",https://www.linkedin.com/in/richkleiman/,,,,,,None,Not Contacted,,,,Sometimes,,,,Duplicate,Same email in rows: 2630,,Partner,,,,,,,,,,,"Best: Q1 (Jan-Mar, new fund year, deploying capital). Avoid: Aug, late Dec (vacation). [Source: industry standard]",,,Medium,,,,3
Richard Buoncore,"MAI Capital Management, LLC",rbuoncore@mai.capital,,Ohio,United States,Family Office,,"AI, Machine Learning",https://linkedin.com/in/richardbuoncore,https://mai.capital/,,,,,None,Not Contacted,,,,Sometimes,,,,Verified — MX Valid,,,Family Office Principal,,,,,,30-60 days,,,,,"Best: After a liquidity event in their portfolio. Q1 (new budgets). Avoid: Q4 (budget freeze), holiday weeks. [Source: FO behavior pattern]",Source: Typical family office relationship-driven timeline,,Medium,,,,3
Richard Maclean,,richard@frontiercapital.com,Charlotte,North Carolina,United States,Angel,,"Clean Tech, Sustainability",https://linkedin.com/in/richard-maclean-324ab119,,,,,,None,Not Contacted,,,,No,,,,Verified — MX Valid,No fund website to cross-reference,,Solo Angel,,,,,,1-14 days,,,,,"Best: Anytime. Avoid: Holiday weeks (late Dec, early Jan). [Source: general angel pattern]",Source: Typical angel investor timeline based on published seed-stage research,,Medium,,,,3
Riley Jarman,,r.jarman@epicvc.com,,,,VC,,"Software, IT, Healthcare",https://www.linkedin.com/in/riley-jarman/,http://epicvc.com,,,,,None,Not Contacted,,,,Sometimes,,,,Verified — MX Valid,,,Partner,,,,,,,,,,,"Best: Q1 (Jan-Mar, new fund year, deploying capital). Avoid: Aug, late Dec (vacation). [Source: industry standard]",,,Medium,,,,3
Rishi Aggarwal,,rish.aggarwal@humanventures.co,,,,VC,,"Education, Media, Entertainment, Healthcare, Software, Internet",https://www.linkedin.com/in/rish-aggarwal/,,,,,,None,Not Contacted,,,,Sometimes,,,,Verified — MX Valid,No fund website to cross-reference,,Partner,,,,,,,,,,,"Best: Q1 (Jan-Mar, new fund year, deploying capital). Avoid: Aug, late Dec (vacation). [Source: industry standard]",,,Medium,,,,3
RJ Mahadev,RJ Mahadev,rj@aiota.solutions,,,,Angel,,"Prop Tech, AI, IoT, Industry 4.0",https://www.linkedin.com/in/rjmahadev/,https://www.rjmahadev.com,,,,,None,Not Contacted,,,,No,,,,Domain Mismatch,Email domain (aiota.solutions) != fund domain (rjmahadev.com),,Solo Angel,,,,,,1-14 days,,,,,"Best: Anytime. Avoid: Holiday weeks (late Dec, early Jan). [Source: general angel pattern]",Source: Typical angel investor timeline based on published seed-stage research,,Medium,,,,3
Roger Lang,,roger@langstudios.com,,,United States,VC/Venture Studio,"Growth-stage, Seed, Series A, Series B+","AI (Artificial Intelligence), Sustainable Agriculture, infrastructure, Food Tech, Technology",https://www.linkedin.com/in/roger-lang-736b/?utm_source=share&utm_campaign=share_via&utm_content=profile&utm_medium=android_app,,,,,,None,Not Contacted,,,,No,,,,Verified — MX Valid,No fund website to cross-reference,,,,,,,,,,,,,"Best: Q1 (Jan-Mar, new fund year, deploying capital). Avoid: Aug, late Dec (vacation). [Source: industry standard]",,,Medium,,,,3
Ryan Bloomer,,rb@kairoshq.com,,,,VC,,"Health, Finances, Education, Housing, and Future of Work",https://linkedin.com/in/ryan-bloomer-b3925a4,https://www.k50ventures.com/,,,,,None,Not Contacted,,,,Sometimes,,,,Domain Mismatch,Email domain (kairoshq.com) != fund domain (k50ventures.com),,Partner,,,,,,,,,,,"Best: Q1 (Jan-Mar, new fund year, deploying capital). Avoid: Aug, late Dec (vacation). [Source: industry standard]",,,Medium,,,,3
Sam Desheh,Humana Ventures,sam@humana.com,,,,CVC,,,https://linkedin.com/in/samdesheh,https://www.humana.com,Yes,$2M-$10M,,,,Not Contacted,,$300M+,,,,,,,,,,,,,,,,,,,,,,,,,,,3
Shak Il Ahmed,Savola Group,engg_shac@hotmail.com,New York,New York,United States,Family Office,,"Healthcare, Medical",https://linkedin.com/in/shakilahmedk,https://www.savola.com,,,,,None,Not Contacted,,,,Sometimes,,,,Personal Email — MX Valid,,,Family Office Principal,,,,,,30-60 days,,,,,"Best: After a liquidity event in their portfolio. Q1 (new budgets). Avoid: Q4 (budget freeze), holiday weeks. [Source: FO behavior pattern]",Source: Typical family office relationship-driven timeline,,Medium,,,,3
Simeon Iheagwam,,simeon@noemisventures.com,New York,New York,United States,Angel,,"Fintech, AI, Marketplaces",https://linkedin.com/in/simeon-iheagwam-8b54404,,,,,,None,Not Contacted,,,,No,,,,Verified — MX Valid,No fund website to cross-reference,,Solo Angel,,,,,,1-14 days,,,,,"Best: Anytime. Avoid: Holiday weeks (late Dec, early Jan). [Source: general angel pattern]",Source: Typical angel investor timeline based on published seed-stage research,,Medium,,,,3
SparkLabs,SparkLabs,,Seoul,,South Korea,Accelerator,Seed,"IoT, FinTech, AI, Commerce",https://www.linkedin.com/company/sparklabs/,https://www.sparklabs.co.kr,Yes,$40K-$100K,https://www.sparklabs.co.kr/apply,,None,Not Contacted,,,,,,,,,,,,,,,,,,,,,,,,,Medium,,,,3
Stanford Angels & Entrepreneurs,,,Palo Alto,,United States,Angel Group,"Seed, Early-stage","Technology, AI, Consumer, Healthcare",,,Sometimes,$25K-$150K,,,None,Not Contacted,,,,No,,,,,,,Solo Angel,,,,,,1-14 days,,,,,"Best: Anytime. Avoid: Holiday weeks (late Dec, early Jan). [Source: general angel pattern]",Source: Typical angel investor timeline based on published seed-stage research,,Medium,,,,3
StartUp Health,StartUp Health,,New York,New York,United States,Accelerator,"Seed, Series A","Health, HealthTech",https://www.linkedin.com/company/startup-health/,https://www.startuphealth.com,No,Network + media,https://www.startuphealth.com/apply,,None,Not Contacted,,,,,,,,,,,,,,,,,,,,,,,,,Medium,,,,3
Startup Wise Guys,Startup Wise Guys,,Tallinn,,Estonia,Accelerator,"Pre-seed, Seed","B2B SaaS, Fintech, Sustainability",https://www.linkedin.com/company/startupwiseguys/,https://startupwiseguys.com,Yes,$50K-$85K,https://startupwiseguys.com/apply,,None,Not Contacted,,,,,,,,,,,,,,,,,,,,,,,,,Medium,,,,3
Steve Davis,Jemison Investment Company,sdavis@jemisonmetals.com,,Alabama,United States,Family Office,,"Social, AI, Consumer, Media",https://linkedin.com/in/steve-davis-a5b0593a,https://www.jemisoninvestmentcompany.com,,,,,None,Not Contacted,,,,Sometimes,,,,Domain Mismatch,Email domain (jemisonmetals.com) != fund domain (jemisoninvestmentcompany.com),,Family Office Principal,,,,,,30-60 days,,,,,"Best: After a liquidity event in their portfolio. Q1 (new budgets). Avoid: Q4 (budget freeze), holiday weeks. [Source: FO behavior pattern]",Source: Typical family office relationship-driven timeline,,Medium,,,,3
