Name,Fund,Email,Location (City),Location (State),Location (Country),Type of Investor,Stage: Investment Thesis,Sector: Investment Thesis,LinkedIn,Website,Leads Rounds?,Typical Check Size,Pitch Submission URL,Warm Intro Path,Relationship Strength,Status,Priority Tier,Fund Size,Notable Portfolio Companies,Takes Board Seats?,Founder Reputation,Investor Content,Investor Tempo,Email Status,Email Notes,Known Co-Investors,Decision Authority,Anti-Portfolio (Known Passes),How to Pitch This Investor,Red Flags / Won't Invest,Open Access / Office Hours,Typical Response Time,Avg Days to Term Sheet,Founder Diversity Track Record,Social Activity Score,Primary Social Platform,Common Pass Reasons,Best Time to Pitch,Term Sheet Source,Reputation Notes,Data Confidence Level,Last Verified Date,Corrections Made,Deduplication Notes,Quality Score
Mar Hershenson,pear VC,mar@pear.vc,Los Altos,California,United States,VC,"Pre-seed, Seed","AI, SaaS, Consumer, Enterprise",https://www.linkedin.com/in/mar-hershenson-b21395/,https://pear.vc,Yes,$250K-$2M,https://pear.vc/pitch/,,None,Not Contacted,High,$450M,"DoorDash, Guardant Health, Branch, Vanta, Aurora Solar",Yes,5,Pear VC blog: pear.vc/blog | Stanford talks on technical mentorship,Fast (1-2 weeks),Verified — MX Valid,,"Y Combinator, First Round, Floodgate, True Ventures",GP / Decision Maker,,"At Pear VC, she's publicly stated she invests at the earliest stages in technical founders. Pear runs a fellowship — apply there. She values deep technical ability and founder-market fit.","Invests at earliest stages in technical founders only. Pear runs a fellowship — apply there. Values deep technical ability. Source: pear.vc/blog, Stanford talks.",Apply: pear.vc/pitch/ | Events: Pear VC fellowship (open application),,7-14 days,,5,Twitter/X,"Non-technical co-founding team; No raw talent and determination; Too late stage for Pear [Source: pear.vc/blog, Stanford talks]","Best: Apply to Pear Fellowship — rolling applications. Q1 is best (new fund year). Avoid: Aug, late Dec. [Source: pear.vc, industry standard]",Source: Pear VC fast seed decisions; pear.vc,"Pear VC co-founder. Deep technical background (Stanford PhD). Known for hands-on technical mentorship. Pear has exceptional seed-stage reputation. [Source: General community reputation based on public founder testimonials, blog posts, podcast interviews, and published accounts. Not independently verified.]",Medium,,,,11
Alfred Lin,Sequoia Capital,alfred@sequoiacap.com,Menlo Park,,United States,VC,"Seed, Series A","Consumer, Marketplace, AI",https://linkedin.com/in/alfredlin,https://www.sequoiacap.com,Yes,$1M-$100M+,https://www.sequoiacap.com/build/,,None,Not Contacted,High,$10B+,"Airbnb, Stripe, DoorDash, Zoom, Unity, Figma, Klarna, Apple, Google, WhatsApp",Yes,,,Medium (3-6 weeks),Verified — MX Valid,,"Sequoia, a16z, Benchmark, Y Combinator",GP / Decision Maker,,"At Sequoia Capital, he's publicly stated he looks for 'culture as a competitive advantage' (from his Zappos experience). He's said on podcasts he evaluates founding teams on values and mission clarity. He focuses on consumer, enterprise, and fintech. Get a warm intro.",Deep tech and frontier companies. Source: A Capital thesis.,Apply: https://www.sequoiacap.com/build/,No response if not interested,14-30 days,,,,"Can't answer 'why now?'; Team not strong enough; Market timing wrong; Incremental idea [Source: Sequoia pitch template, multiple books]",Best: Q1 (Jan-Mar). Note: Moritz largely retired from active Sequoia investing. [Source: industry standard],Source: Known scout → partner → Monday meeting pipeline; published founder accounts,,Medium,,,,10
Anjney Midha,a16z (Andreessen Horowitz),anjney@a16z.com,San Francisco,,United States,VC,"Seed, Series A","AI, Gaming, Consumer",https://linkedin.com/in/anjney,https://a16z.com,,,https://a16z.com/pitch/,,None,Not Contacted,High,$35B+,"Coinbase, Instacart, Roblox, Databricks, Figma, Slack, GitHub, Airbnb, Lyft, Substack",Yes,,,Medium (3-6 weeks),Verified — MX Valid,,"Sequoia, Coinbase Ventures, Paradigm, Founders Fund, GV, Greylock",GP / Decision Maker,,"At a16z, he focuses on gaming and AI. He's publicly stated he looks for companies using AI to transform creative workflows and gaming experiences.",,Apply: https://a16z.com/pitch/,2-3 weeks,14-30 days,,,,,"Best: Q1 (Jan-Mar, new fund year, deploying capital). Avoid: Aug, late Dec (vacation). [Source: industry standard]",Source: Structured process but efficient; published founder accounts on 20VC,,Medium,,,,10
David Sacks,Craft Ventures,david@craftventures.com,San Francisco,,United States,VC,"Seed, Series A, Series B","AI, SaaS, Marketplace, Enterprise",https://linkedin.com/in/davidsacks,https://www.craftventures.com,Yes,$1M-$15M,https://www.craftventures.com/pitch,,None,Not Contacted,High,$2B+,"Tesla, SpaceX, Uber, Lyft, Bird, AirGarage, OpenPhone",Yes,,,Fast (1-2 weeks),Verified — MX Valid,,"Craft Ventures, Founders Fund, a16z, Jason Calacanis, Keith Rabois",GP / Decision Maker,,"He's vocal on the All-In Podcast about his investment philosophy. At Craft Ventures, he's published the Craft playbook and grid framework publicly. He's stated he looks for 'product-led growth' and strong go-to-market. Lead with your GTM strategy, not just the product. He values capital efficiency and has been publicly critical of 'growth at all costs.' Reference specific All-In episodes.","David Sacks' firm — very opinionated. Known for strong product opinions on All-In Podcast. Can be vocal publicly about portfolio disagreements. Source: Craft Ventures writing, All-In Podcast.",Apply: craftventures.com/pitch,,7-14 days,,,,"Weak product opinions; Can't articulate product differentiation; Outside Craft's thesis areas [Source: craftventures.com/writing, David Sacks/All-In Podcast]","Best: Q1 (Jan-Mar). Apply: craftventures.com/pitch. Avoid: Aug, late Dec. [Source: craftventures.com, industry standard]",Source: David Sacks known for fast decisions; All-In Podcast,,Medium,,,,10
Eric Bahn,Hustle Fund,eric@hustlefundvc.com,San Francisco,California,United States,VC,"Pre-seed, Seed","Consumer, SaaS, AI, Marketplaces",https://linkedin.com/in/ericbahn,https://www.hustlefund.vc/,Sometimes,$25K-$250K,https://www.hustlefund.vc/apply,,None,Not Contacted,Medium,$50M,"Deel, Middesk, Snackpass, Lunchclub, Oura",Sometimes,4,Blog: hustlefund.vc/blog | Twitter: @ericbahn | Podcast: Hustle Fund content | YouTube: Hustle Fund,Very Fast (days),Domain Mismatch,Email domain (hustlefundvc.com) != fund domain (hustlefund.vc),"Precursor Ventures, Backstage Capital, 500 Global, Techstars",GP / Decision Maker,,"Co-founder of Hustle Fund. Apply on hustlefund.vc — they move fast (48-hour decisions). He's publicly stated they back 'hustlers, not pedigrees.' He's said on Twitter and podcasts they look for scrappiness, capital efficiency, and founders who can do more with less. Elizabeth Yin (co-founder) blogs about what they look for — read it.","Hustle Fund: Won't invest over $1M check size. Won't lead rounds. Backs 'hustlers, not pedigrees.' Values scrappiness and capital efficiency. 48-hour decisions. Source: hustlefund.vc website, Twitter @ericbahn. Passes on martech — outside strike zone. Strike zone: B2B SaaS, Fintech, Digital Health, Web3. [Source: Hustle Fund rejection, March 2025]",Apply: hustlefund.vc/apply (48hr decisions) | Office Hours: Hustle Fund AMA sessions | DMs Open: Twitter/X (@ericbahn),24-48 hours,1-7 days,"Hustle Fund — 43% female founders, 58% non-white founders in portfolio. Source: hustlefund.vc",4,Twitter/X,"Raising too much (>$2M); Want to lead rounds (Hustle Fund doesn't lead); Not capital-efficient; Not scrappy enough [Source: hustlefund.vc website, Elizabeth Yin blog, Twitter @ericbahn]","Best: Anytime — they invest year-round, no batch. 48-hour decisions. Apply: hustlefund.vc/apply. [Source: Elizabeth Yin, hustlefund.vc]",Source: Hustle Fund 48-hour decisions; hustlefund.vc,"Hustle Fund. Known for extremely founder-friendly terms, fast decisions, and genuine support for underrepresented founders. Early Deel, Middesk. [Source: General community reputation based on public founder testimonials, blog posts, podcast interviews, and published accounts. Not independently verified.]",Medium,,,,10
Hunter Walk,Homebrew,hunter@homebrew.co,San Francisco,,United States,VC,Seed,"Consumer, Media, AI, Creator",https://linkedin.com/in/hunterwalk,https://www.homebrew.co,Yes,$1M-$5M,https://homebrew.co/pitch,,None,Not Contacted,High,$90M,"Plaid, Gusto, Carta, Stitch Fix, Going (Scott's Cheap Flights)",Yes,,,Fast (1-2 weeks),Verified — MX Valid,,"Homebrew, First Round, Floodgate, True Ventures, Slow Ventures",GP / Decision Maker,,"At Homebrew, he's published 'The Homebrew Manifesto' and blogs regularly. He's publicly stated he looks for 'the bottom-up economy' — products that empower individuals and small teams. He's said he values 'earned insights' from founders. He's responsive on Twitter and values authentic engagement.",,Apply: https://homebrew.co/pitch,,7-14 days,,,,,"Best: Q1 (Jan-Mar, new fund year, deploying capital). Avoid: Aug, late Dec (vacation). [Source: industry standard]",Source: Investor's documented fast response time in database,,Medium,,,,10
Laurene Powell Jobs,Emerson Collective LLC,laurene@emersoncollective.com,,California,United States,Family Office,"Seed, Series A, Series B+","Social Impact, Education, Media",https://linkedin.com/in/laurene-powell-jobs-29ba9882,https://www.emersoncollective.com,Sometimes,$500K-$10M,https://www.emersoncollective.com/submit/,,None,Not Contacted,Low,$3B+,"Axios, College Track, XQ Institute, Monumental Sports",Sometimes,3,"Emerson Collective content: emersoncollective.com | Media: The Atlantic, Axios ownership",Slow (2-6 months),Verified — MX Valid,,"Omidyar Network, a16z Impact, GV",GP / Decision Maker,,"Through Emerson Collective, she's publicly stated she invests in education, immigration reform, environment, and media. The fund publishes its focus areas. She's highly selective — warm intros required.","Focused on education, immigration reform, environment, and media. Highly selective — warm intros required. Can be slow process. Source: emersoncollective.com.",Apply: emersoncollective.com/submit/,1 month+,60-90 days,,,,"Not focused on education, immigration reform, environment, or media; Investing purely for returns without social impact [Source: emersoncollective.com]",Best: Q1 (Jan-Mar). Apply: emersoncollective.com/submit/. Very slow process (2-6 months). [Source: emersoncollective.com],Source: Emerson Collective slow/bureaucratic; emersoncollective.com,"Emerson Collective. Steve Jobs' widow. Massive resources, impact-focused. Professional but can be slow/bureaucratic. [Source: General community reputation based on public founder testimonials, blog posts, podcast interviews, and published accounts. Not independently verified.]",Medium,,,,10
Michael Berolzheimer,Bee Partners,michael@beepartners.vc,San Francisco,California,United States,VC,,"Healthcare, Health and Wellness, Music, Media, Blockchain, Food and Beverage",https://linkedin.com/in/berolzheimer,https://www.beepartners.com,,,,,None,Not Contacted,High,$50M,"Verkada, Freenome, Shape Security, Health IQ",Sometimes,3,Bee Partners blog: beepartners.com/blog | Deep tech seed thesis,,Domain Mismatch,Email domain (beepartners.vc) != fund domain (beepartners.com),"True Ventures, Root Ventures, Lux Capital, First Round",GP / Decision Maker,,"At Bee Partners, he focuses on pre-seed and seed investments in frontier tech.",,,,7-14 days,,3,LinkedIn,,"Best: Q1 (Jan-Mar, new fund year, deploying capital). Avoid: Aug, late Dec (vacation). [Source: industry standard]",Source: Seed deep tech fund; relatively fast; beepartners.com,"Bee Partners. Good reputation in hardware/deep tech seed. Early Verkada, Freenome. [Source: General community reputation based on public founder testimonials, blog posts, podcast interviews, and published accounts. Not independently verified.]",Medium,,,,10
Mike Maples Jr.,Floodgate,mike@floodgate.com,Palo Alto,,United States,VC,Seed,"Consumer, Enterprise, AI",https://linkedin.com/in/mikemaplesjr,https://www.floodgate.com,Yes,$250K-$2M,https://floodgate.com/pitch/,,None,Not Contacted,High,$200M,"Twitter, Lyft, Twitch, Refinery29, Chegg, Demandbase",Yes,,,Fast (1-2 weeks),Verified — MX Valid,,"Floodgate, First Round, True Ventures, Homebrew, SV Angel",GP / Decision Maker,,"At Floodgate, he's publicly coined 'thunder lizards' — startups that create new categories rather than compete in existing ones. He's said on podcasts he looks for 'inflections' (technology shifts that create openings). Lead with what inflection you're riding and why you'll define the category. He's written about this framework extensively.",,Apply: https://floodgate.com/pitch/,,7-14 days,,,,"Not a category-creating company; Not a 'thunder lizard' (Mike Maples' framework); Too incremental [Source: Floodgate thesis, medium.com/@m2jr]","Best: Q1 (Jan-Mar). Avoid: Aug, late Dec. [Source: industry standard]",Source: Seed fund known for fast decisions; Mike Maples Jr Medium posts,,Medium,,,,10
Mitchell Kapor,Kapor Capital,mitch@kaporcapital.com,,California,United States,VC,"Pre-seed, Seed","Social Impact, Enterprise",https://linkedin.com/in/mitchkapor,https://www.kapor.com,Yes,$250K-$2M,https://www.kaporcapital.com/pitch/,,None,Not Contacted,Low,$250M,"Bitwise Industries, Pigeonly, Ureeka, MiSalud, Samasource",Yes,3,Kapor Capital content: kaporcapital.com/blog | Gap-closing investing thesis,Medium (3-6 weeks),Domain Mismatch,Email domain (kaporcapital.com) != fund domain (kapor.com),"Precursor Ventures, Backstage Capital, Reach Capital",GP / Decision Maker,,"Founded Lotus Development. At Kapor Capital, they've publicly stated they invest in 'gap-closing' companies — startups that close gaps of access, opportunity, or outcome for underrepresented communities. They're explicitly focused on social impact through technology.",Focused on 'gap-closing' companies — must close gaps of access/opportunity for underrepresented communities. Social impact requirement. Source: kaporcapital.com/blog.,Apply: kaporcapital.com/pitch/,2-3 weeks,14-30 days,"Kapor Capital founder — explicit diversity mandate, 'gap-closing' companies for underrepresented communities. Source: kaporcapital.com",3,LinkedIn,Not a 'gap-closing' company — must close gaps of access/opportunity for underrepresented communities; No social impact angle [Source: kaporcapital.com/blog],"Best: Q1 (Jan-Mar). Apply: kaporcapital.com/pitch/. Avoid: Aug, late Dec. [Source: kaporcapital.com, industry standard]",Source: Structured gap-closing evaluation; kaporcapital.com,"Kapor Capital. Known for gap-closing, social impact investing. Strong diversity focus. Professional. [Source: General community reputation based on public founder testimonials, blog posts, podcast interviews, and published accounts. Not independently verified.]",Medium,,,,10
Roelof Botha,Sequoia Capital,roelof@sequoiacap.com,Menlo Park,,United States,VC,All Stages,"Consumer, Fintech, AI",https://linkedin.com/in/roelofbotha,https://www.sequoiacap.com,Yes,$1M-$100M+,https://www.sequoiacap.com/build/,,None,Not Contacted,High,$10B+,"Airbnb, Stripe, DoorDash, Zoom, Unity, Figma, Klarna, Apple, Google, WhatsApp",Yes,,,Medium (3-6 weeks),Verified — MX Valid,,"Sequoia, a16z, Benchmark, Founders Fund",GP / Decision Maker,,"At Sequoia Capital (now chairman), he's publicly stated on podcasts that he looks for 'legendary companies' — businesses that will matter in 20 years. He's said he values founders who think about their company as a 'cathedral' being built over decades. Lead with the long-term vision. Sequoia requires warm intros and partner match.",Deep tech and frontier companies. Source: A Capital thesis.,Apply: https://www.sequoiacap.com/build/,No response if not interested,14-30 days,,,,"Can't answer 'why now?'; Team not strong enough; Market timing wrong; Incremental idea [Source: Sequoia pitch template, multiple books]",Best: Q1 (Jan-Mar). Note: Moritz largely retired from active Sequoia investing. [Source: industry standard],Source: Known scout → partner → Monday meeting pipeline; published founder accounts,,Medium,,,,10
Alex Taussig,Lightspeed Venture Partners,alex@lsvp.com,Menlo Park,California,United States,VC,"Seed, Series A, Series B, Growth","AI, Consumer, Enterprise, Health, Fintech, Creator Economy",https://linkedin.com/in/alextaussig,https://lsvp.com,Yes,$1M-$50M+,https://lsvp.com/pitch/,,,,Tier 1,$10B+,"Snap, Affirm, Carta, Rubrik, Mulesoft, Epic Games, Grubhub, AppDynamics",Yes,,,Medium (3-6 weeks),Verified — MX Valid,,"Sequoia, Accel, GV, a16z, Greylock",GP / Decision Maker,,"At Lightspeed, he focuses on consumer and fintech. He's published 'Drinking from the Firehose' newsletter with his investment thinking. He's publicly stated he values data-informed founders who understand user behavior deeply.",,Apply: https://lsvp.com/pitch/,2-3 weeks,14-30 days,,,,,"Best: Q1 (Jan-Mar, new fund year, deploying capital). Avoid: Aug, late Dec (vacation). [Source: industry standard]",Source: Structured multi-meeting; published founder accounts,,,,,,9
Allison Scott,Kapor Capital,allison@kaporcenter.org,,California,United States,VC,"Early-stage, Growth-stage","Social Impact, Enterprise",https://linkedin.com/in/allison-scott-ph-d-483b9027`,https://www.kapor.com,Yes,$250K-$2M,https://www.kaporcapital.com/pitch/,,None,Not Contacted,Low,$250M,"Bitwise Industries, Pigeonly, Ureeka, MiSalud, Samasource",Yes,3,,Medium (3-6 weeks),Domain Mismatch,Email domain (kaporcenter.org) != fund domain (kapor.com),"Precursor Ventures, Backstage Capital, Reach Capital",GP / Decision Maker,,,Focused on 'gap-closing' companies — must close gaps of access/opportunity for underrepresented communities. Social impact requirement. Source: kaporcapital.com/blog.,Apply: kaporcapital.com/pitch/,2-3 weeks,14-30 days,"Kapor Capital — explicit diversity mandate, 'gap-closing' companies. Source: kaporcapital.com",3,LinkedIn,Not a 'gap-closing' company — must close gaps of access/opportunity for underrepresented communities; No social impact angle [Source: kaporcapital.com/blog],"Best: Q1 (Jan-Mar). Apply: kaporcapital.com/pitch/. Avoid: Aug, late Dec. [Source: kaporcapital.com, industry standard]",Source: Structured gap-closing evaluation; kaporcapital.com,"Kapor Capital. Same firm reputation. [Source: General community reputation based on public founder testimonials, blog posts, podcast interviews, and published accounts. Not independently verified.]",Medium,,,,9
Arif Janmohamed,Lightspeed Venture Partners,arif@lsvp.com,Menlo Park,California,United States,VC,"Seed, Series A, Series B, Growth","AI, Consumer, Enterprise, Health, Fintech, Creator Economy",https://linkedin.com/in/arifj,https://lsvp.com,Yes,$1M-$50M+,https://lsvp.com/pitch/,,,,Tier 1,$10B+,"Snap, Affirm, Carta, Rubrik, Mulesoft, Epic Games, Grubhub, AppDynamics",Yes,,,Medium (3-6 weeks),Verified — MX Valid,,"Sequoia, Accel, GV, a16z, Greylock",GP / Decision Maker,,"At Lightspeed Venture Partners, he focuses on enterprise and SaaS. He's publicly stated he looks for companies with 'land and expand' go-to-market strategies. Lightspeed publishes sector insights on their blog.",,Apply: https://lsvp.com/pitch/,2-3 weeks,14-30 days,,,,,"Best: Q1 (Jan-Mar, new fund year, deploying capital). Avoid: Aug, late Dec (vacation). [Source: industry standard]",Source: Structured multi-meeting; published founder accounts,,,,,,9
Aydin Senkut,Felicis Ventures,aydin@felicis.com,Menlo Park,California,United States,VC,"Seed, Series A, Series B","AI, Consumer, Health, Enterprise, Fintech",https://linkedin.com/in/aydinsenkut,https://felicis.com,Yes,$500K-$10M,https://www.felicis.com/pitch,,,,Tier 1,$900M,"Shopify, Credit Karma, Fitbit, Adyen, Canva, Notion, Plaid",Yes,,,Medium (3-6 weeks),Verified — MX Valid,,"Founders Fund, Craft Ventures, First Round, a16z, Bessemer",GP / Decision Maker,,"At Felicis Ventures, he's publicly stated he looks for 'audacious founders' tackling global problems. He's said he was early to Shopify, Fitbit, and Credit Karma because he saw demographic shifts. Lead with the macro trend you're riding. Felicis publishes its portfolio thesis on their website.",,Apply: https://www.felicis.com/pitch,2-3 weeks,14-30 days,,,,,"Best: Q1 (Jan-Mar, new fund year, deploying capital). Avoid: Aug, late Dec (vacation). [Source: industry standard]",Source: Investor's documented medium response time in database,,,,,,9
David Waxman,TenOneTen,david@tenoneten.net,Los Angeles,California,United States,VC,,"Enterprise, Consumer, AI",https://linkedin.com/in/dwaxman,http://tenoneten.net/,,,,,None,Not Contacted,Low,$100M,"Ring, Dollar Shave Club, Parachute Home, Bird (TenOneTen)",Sometimes,3,TenOneTen blog: tenoneten.net/blog | LA tech thesis,Fast (1-2 weeks),Verified — MX Valid,,,GP / Decision Maker,,"At TenOneTen Ventures, he's publicly stated he invests in data science-driven companies in LA.",LA-based seed fund focused on data science-driven companies. Source: tenoneten.net/blog.,,,7-14 days,,3,LinkedIn,Not data science-driven; Not LA-based [Source: tenoneten.net/blog],"Best: Q1 (Jan-Mar). Avoid: Aug, late Dec. [Source: industry standard]",Source: TenOneTen fast LA seed decisions; tenoneten.net,"TenOneTen. LA-based seed fund. Early Ring, Dollar Shave Club, Bird. [Source: General community reputation based on public founder testimonials, blog posts, podcast interviews, and published accounts. Not independently verified.]",Medium,,,,9
Hemant Taneja,General Catalyst,hemant@generalcatalyst.com,San Francisco,,United States,VC,Seed through Growth,"AI, Healthcare, Enterprise",https://linkedin.com/in/hemanttaneja,https://www.generalcatalyst.com,Yes,$1M-$50M+,mailto:pitch@generalcatalyst.com,,None,Not Contacted,Medium,$25B+,"Stripe, Airbnb, Snap, HubSpot, Warby Parker, Lemonade, Livongo, Anduril",Yes,,,Medium (3-6 weeks),Verified — MX Valid,,"Sequoia, a16z, Accel, Thrive Capital, Stripe",GP / Decision Maker,,"At General Catalyst, he wrote 'Unscaled' — reference it. He's publicly stated he invests in companies that leverage AI and technology to 'unscale' large incumbents. He's said he looks for founders who understand how technology changes industry structure. GC has published its 'responsible innovation' framework.",Large fund — can be slow. Medium process (3-6 weeks). Source: generalcatalyst.com/perspectives.,Apply: mailto:pitch@generalcatalyst.com,2-3 weeks,14-30 days,,,,"Not 'culturally aware'; Doesn't understand generational shifts; Not consumer/gaming/media focused [Source: generalcatalyst.com/perspectives, Twitter @nikobonatsos]","Best: Q1 (Jan-Mar, new fund year). Avoid: Aug, late Dec. [Source: industry standard]",Source: Standard multi-meeting process; published founder accounts,,Medium,,,,9
Jill Carlson,Slow Ventures,jill@slow.co,San Francisco,California,United States,VC,"Pre-Seed, Seed, Series A","Consumer, Media, Creator Economy, AI, Entertainment",https://linkedin.com/in/jillcarlson,https://slow.co,Sometimes,$100K-$1M,https://slow.co/pitch,,,,Tier 1,$200M,"Coinbase, Slack, Carta, Dollar Shave Club, Casper",Yes,,,,Verified — MX Valid,,"Homebrew, First Round, Founders Fund, SV Angel, Lowercase Capital",GP / Decision Maker,,"At Slow Ventures, she focuses on crypto and fintech. She's publicly stated she looks for founders building financial infrastructure for the next era. She's written extensively about crypto regulation and markets.",,Apply: https://slow.co/pitch,,,,,,,"Best: Q1 (Jan-Mar, new fund year, deploying capital). Avoid: Aug, late Dec (vacation). [Source: industry standard]",,,,,,,9
Kim-Mai Cutler,Initialized Capital,kim-mai@initialized.com,San Francisco,California,United States,VC,"Pre-Seed, Seed","AI, Consumer, SaaS, Health, Creator Economy",https://linkedin.com/in/kimmaicutler,https://initialized.com,Yes,$250K-$2M,https://initialized.com/pitch,,,,Tier 1,$700M,"Coinbase, Instacart, Cruise, Zenefits, Flexport, Rippling",Yes,,,Fast (1-2 weeks),Verified — MX Valid,,"Y Combinator, a16z, Sequoia, SV Angel, Founders Fund",GP / Decision Maker,,"At Initialized Capital, she's a former TechCrunch journalist. She's publicly stated she looks for founders who can tell a compelling narrative about market transformation. She values founders who deeply understand policy and infrastructure.",,Apply: https://initialized.com/pitch,,7-14 days,,,,,"Best: Q1 (Jan-Mar, new fund year, deploying capital). Avoid: Aug, late Dec (vacation). [Source: industry standard]",Source: Investor's documented fast response time in database,,,,,,9
Lan Xuezhao,Basis Set Ventures,lan@basisset.ventures,San Francisco,California,United States,VC,,"AI, Enterprise, Developer Tools",https://linkedin.com/in/xuezhao-lan-50aa1a1,https://basisset.ventures/,,,,,None,Not Contacted,Low,$150M,"Verkada, Skyflow, Persona, Loom, Miro",Sometimes,3,Basis Set Ventures blog: basisset.ventures/blog | AI investing thesis,,Verified — MX Valid,,,GP / Decision Maker,,"At Basis Set Ventures, she's publicly stated she invests in AI and machine learning companies. She's said she focuses on AI applications in enterprise, with a special interest in backing female founders.",AI/ML companies only. Source: basisset.ventures/blog.,,,7-14 days,,3,LinkedIn,Not AI/ML focused; Not enterprise AI application [Source: basisset.ventures/blog],"Best: Q1 (Jan-Mar). Avoid: Aug, late Dec. [Source: industry standard]",Source: Basis Set fast AI seed decisions; basisset.ventures,"Basis Set Ventures. AI-focused fund. Good reputation. Early Verkada, Loom, Miro. [Source: General community reputation based on public founder testimonials, blog posts, podcast interviews, and published accounts. Not independently verified.]",Medium,,,,9
