Luke Sheridan,Octopus Ventures,luke@octopusventures.com,London,England,United Kingdom,VC,Seed / Series A,"Health, Deep Tech, Fintech, B2B SaaS, Consumer",https://linkedin.com/in/lukesheridan,https://octopusventures.com,Yes,$500K-$5M,,,None,Not Contacted,High,$1.3B,"Zoopla, Secret Escapes, Depop, Elvie, WaveOptics",Yes,4,Octopus blog: octopusventures.com/insights,Active,,,,,Partner,,,,,14-30 days,,,3,LinkedIn,,,One of UK's largest VC firms by portfolio size. Source: octopusventures.com,Medium,,,,7
Mike Duboe,Greylock (former) / Angel,,San Francisco,California,United States,VC,Seed / Series A,"AI, Consumer, Digital Media, Creator Economy, Martech",https://www.linkedin.com/in/mikeduboe/,https://www.greylock.com,,,,,,,High,$3.5B+,"Facebook, LinkedIn, Airbnb, Discord, Figma, Roblox, Coinbase, Palo Alto Networks",Yes,,,Medium (3-6 weeks),,,"Sequoia, Benchmark, Accel, a16z, IVP",GP / Decision Maker,,,,,2-3 weeks,14-30 days,,,,,"Best: Q1 (Jan-Mar, new fund year, deploying capital). Avoid: Aug, late Dec (vacation). [Source: industry standard]",Source: Top-tier firm with structured process; published accounts,,Medium,,,,7
Naveen Wadhera,TA Associates,naveen@ta.com,Menlo Park,CA,US,VC,Growth Equity / Late Stage,Healthcare IT / SaaS,https://www.linkedin.com/in/naveenwadhera/,https://www.ta.com,Yes,$100M-$500M,,,,Not Contacted,,$48B+,,,,,,,,,,,,,,,,,,,,,,,High,,,,7
Nick Beim,Venrock,nick@venrock.com,Palo Alto,California,United States,VC,"Seed, Series A, Series B","AI, Health, Consumer, Enterprise",https://linkedin.com/in/nickbeim,https://venrock.com,Yes,$1M-$20M,https://www.venrock.com/pitch/,,,,Tier 1,$3B+,,Yes,,,,Verified — MX Valid,,,GP / Decision Maker,,,,Apply: https://www.venrock.com/pitch/,,,,,,,"Best: Q1 (Jan-Mar, new fund year, deploying capital). Avoid: Aug, late Dec (vacation). [Source: industry standard]",,,,,,,7
Norrsken VC,Norrsken Foundation,info@norrskenfoundation.org,Stockholm,,Sweden,VC / Impact,Seed / Series A,"Impact, Climate, Health, Fintech, Education",https://linkedin.com/company/norrsken-foundation,https://norrsken.org,Yes,$200K-$5M,,,None,Not Contacted,High,$200M,"Norrsken House portfolio, Voi (connected)",No,4,,,,,,,Fund,,,Impact thesis required.,Non-impact,,14-30 days,,,,3,,Niklas Adalberth (Klarna co-founder) impact VC. Source: norrsken.org,Medium,,,,7
Northstar (Daniel Ek),Northstar (Spotify founder),daniel@northstar.vc,Stockholm,,Sweden,Family Office,Seed / Growth,"Consumer, Health, Climate, AI",https://linkedin.com/in/danielek,https://northstar.vc,Yes,$500K-$20M,,,None,Not Contacted,High,$1B+,"Prima Materia (health), Neko Health",Yes,5,,,,,,,Family Office,,,,,30+ days,,,4,Twitter/X,,,Spotify founder's family office/VC. Source: northstar.vc,Medium,,,,7
Novo Holdings,Novo Holdings,info@novoholdings.dk,Copenhagen,,Denmark,Family Office / CVC,Series A / Growth,"Life Sciences, Health, Biotech, Industrial Biotech",https://linkedin.com/company/novo-holdings,https://novoholdings.dk,Yes,$5M-$200M,,,None,Not Contacted,High,$100B+ AUM,"Novo Nordisk, Novozymes, CRISPR Therapeutics",Yes,5,,,,,,,Investment Arm,,,Life sciences/health only.,Pure software / no health angle,,30+ days,,,,2,,Novo Nordisk Foundation's investment arm. Massive. Source: novoholdings.dk,Medium,,,,7
Orange Ventures,Orange Ventures,ventures@orange.com,Paris,,France,CVC,Seed / Series A / Growth,"Fintech, Health, Cybersecurity, Enterprise, Africa",https://linkedin.com/company/orange-ventures,https://orangeventures.com,Yes,$500K-$10M,,,None,Not Contacted,High,$350M,"Africa Internet Group, Deezer, Heliogen",Yes,4,,,,,,,CVC,,,,,14-30 days,,,2,LinkedIn,,,Orange Group's VC arm. Source: orangeventures.com,Medium,,,,7
Pete Flint,NFX,pete@nfx.com,San Francisco,California,United States,VC,"Pre-Seed, Seed","AI, Consumer, Marketplace, Network Effects, Health",https://linkedin.com/in/peteflint,https://nfx.com,Yes,$250K-$2M,https://signal.nfx.com/,,,,Tier 1,$500M,,Yes,,,Fast (1-2 weeks),Duplicate,Same email in rows: 314,,GP / Decision Maker,,,Focused on companies with network effects — won't invest without a clear network effect. Published taxonomy at nfx.com. Source: nfx.com/post.,Apply: https://signal.nfx.com/,,7-14 days,,,,No network effects — NFX has published taxonomy of network effect types; Not a marketplace or platform [Source: nfx.com/post],"Best: Q1 (Jan-Mar). Reference specific NFX essay relevant to your company. Avoid: Aug, late Dec. [Source: industry standard]",Source: Seed fund; fast decisions; nfx.com,,,,,,7
Redalpine,Redalpine,info@redalpine.com,Zurich,,Switzerland,VC,Seed / Series A,"SaaS, Deep Tech, AI, Fintech",https://linkedin.com/company/redalpine,https://redalpine.com,Yes,$500K-$5M,,,None,Not Contacted,High,$400M,"N26 (seed!), Taxfix, Yokoy, Ledgy",Yes,4,,,,,,,GP,,,,,7-14 days,,,3,LinkedIn,,,Swiss seed VC. N26 backer. Source: redalpine.com,Medium,,,,7
Rick Marini,https://www.crunchbase.com/person/rick-marini,rmarini@gmail.com,San Francisco,California,United States,Angel,,"Investors in Consumer Health (Pre-Seed), Investors in Consumer Health (Seed), Investors in Consumer Internet, Investors in Crypto/Web3, Investors in E-commerce, Investors in Games, Investors in Marketplaces, Investors in Media/Content, Investors in San Francisco Bay Area (Other Lists), Investors in SMB Software, Investors in Social Commerce, Investors in Social Networks, Investors in Investors who were founders (Other Lists)",https://www.linkedin.com/in/rickmarini/,https://angel.co/rmarini,,,,,None,Not Contacted,High,,"BranchOut (founder), various consumer/digital media angels",No,,,,Personal Email — MX Valid,,,Solo Angel,,,,,,1-14 days,,,,,"Best: Anytime. Avoid: Holiday weeks (late Dec, early Jan). [Source: general angel pattern]",Source: Typical angel investor timeline based on published seed-stage research,,Medium,,,,7
Robert Bosch Venture Capital (RBVC),RBVC,rbvc@bosch.com,Stuttgart,,Germany,CVC,Series A / Growth,"IoT, AI, Mobility, Industry 4.0, Health",https://linkedin.com/company/robert-bosch-venture-capital,https://bosch-ventures.com,Yes,$1M-$15M,,,None,Not Contacted,High,$500M+,"AnyVision, Meshcloud, SENORICS",Yes,4,,,,,,,CVC,,,,,14-30 days,,,2,LinkedIn,,,Bosch's venture arm. Source: bosch-ventures.com,Medium,,,,7
Runa Capital,Runa Capital,info@runacap.com,Luxembourg City,,Luxembourg,VC,Series A / Growth,"Open Source, AI, Enterprise, Deep Tech, Cybersecurity",https://linkedin.com/company/runa-capital,https://runacap.com,Yes,$1M-$10M,,,None,Not Contacted,High,$350M,"NGINX (early), Zopa, MariaDB, Ecwid",Yes,4,,,,,,,GP,,,,,14-30 days,,,3,LinkedIn,,,Open source focused VC. Source: runacap.com,Medium,,,,7
Ryan Floyd,Storm Ventures,ryan@stormventures.com,Menlo Park,California,United States,VC,"Seed, Series A","Enterprise SaaS, AI, B2B",https://linkedin.com/in/ryanfloyd,https://stormventures.com,Yes,$500K-$5M,https://www.stormventures.com/pitch,,,,Tier 2,$200M,,Yes,,,,Verified — MX Valid,,,GP / Decision Maker,,,,Apply: https://www.stormventures.com/pitch,,,,,,,"Best: Q1 (Jan-Mar, new fund year, deploying capital). Avoid: Aug, late Dec (vacation). [Source: industry standard]",,,,,,,7
Saeed Amidi,Plug and Play Tech Center,saeed@plugandplaytechcenter.com,Sunnyvale,California,United States,VC,"Pre-Seed, Seed","AI, Consumer, Health, Enterprise, Fintech, Media",https://linkedin.com/in/saeedamidi,https://plugandplaytechcenter.com,Sometimes,$25K-$500K,https://www.plugandplaytechcenter.com/join/,,,,Tier 2,$200M,,Yes,,,,Verified — MX Valid,,"500 Global, Techstars, various corporate VCs",GP / Decision Maker,,,,Apply: https://www.plugandplaytechcenter.com/join/,,,,,,,"Best: Q1 (Jan-Mar, new fund year, deploying capital). Avoid: Aug, late Dec (vacation). [Source: industry standard]",,,,,,,7
Salesforce Ventures (Europe),Salesforce Ventures,ventures@salesforce.com,London,England,United Kingdom,CVC,Series A / Growth,"Enterprise SaaS, AI, B2B",https://linkedin.com/company/salesforce-ventures,https://salesforceventures.com,Yes,$1M-$30M,,,None,Not Contacted,High,$4B+,"DocuSign, nCino, Snowflake, Zoom",Yes,5,,,,,,,CVC,,,Enterprise SaaS / Salesforce ecosystem.,Non-enterprise / no Salesforce synergy,,14-30 days,,,,3,,Salesforce's venture arm. Source: salesforceventures.com,Medium,,,,7
Sara Ittelson,Wing VC,sara@wing.vc,Palo Alto,CA,US,VC,Seed / Series A,Enterprise / AI,https://www.linkedin.com/in/saraittelson/,https://www.wing.vc,Yes,$1M-$15M,,,,Not Contacted,,$700M,,,,,,,,,,,,,,,,,,,,,,,High,,,,7
Shu Nyatta,Soma Capital,shu@somacap.com,San Francisco,California,United States,VC,"Pre-Seed, Seed","AI, Consumer, SaaS, Health, Fintech",https://linkedin.com/in/shunyatta,https://somacap.com,Sometimes,$50K-$250K,https://www.somacap.com/pitch,,,,Tier 2,$1B+,,Yes,,,,Verified — MX Valid,,"Y Combinator, SV Angel, angel syndicates",GP / Decision Maker,,,Deep tech and frontier companies. Source: A Capital thesis.,Apply: https://www.somacap.com/pitch,,14-30 days,,,,,"Best: Q1 (Jan-Mar, new fund year, deploying capital). Avoid: Aug, late Dec (vacation). [Source: industry standard]",Source: Deep tech focus; structured process,,,,,,7
Siddharth Ram,Accel,sram@accel.com,,,,VC,"Seed, Series A, Series B+","Software, Health, Internet",https://www.linkedin.com/company/accel-vc,http://www.accel.com/,Yes,$1M-$50M,https://www.accel.com/pitch,,None,Not Contacted,,$3B+,"Facebook, Spotify, Slack, Dropbox, Atlassian, CrowdStrike, UiPath, Flipkart, Etsy",Yes,3,Accel content: accel.com/noteworthy,Medium (3-6 weeks),Verified — MX Valid,,"Sequoia, Index Ventures, a16z, General Catalyst, Lightspeed",Partner,,,Top-tier but medium process (3-6 weeks). Source: accel.com/noteworthy.,Apply: accel.com/pitch,2-3 weeks,14-30 days,,3,LinkedIn,Not differentiated enough; Market too small for venture returns; Team not strong enough for Accel's bar [Source: accel.com/noteworthy],"Best: Q1 (Jan-Mar). Apply: accel.com/pitch. Avoid: Aug, late Dec. [Source: accel.com, industry standard]",Source: Top-tier firm with structured process; published founder accounts,"Accel. Top-tier global VC. Strong reputation overall. Early Facebook, Spotify, Slack, Dropbox. [Source: General community reputation based on public founder testimonials, blog posts, podcast interviews, and published accounts. Not independently verified.]",Medium,,,,7
Siemens Next47,Siemens Next47,info@next47.com,Munich,,Germany,CVC,Seed / Series A / Growth,"Deep Tech, Industrial AI, IoT, Cybersecurity, Energy",https://linkedin.com/company/next47,https://next47.com,Yes,$1M-$30M,,,None,Not Contacted,High,$1B,"CrowdStrike (early), Formlabs, Markforged",Yes,4,,,,,,,CVC,,,Industrial/deep tech alignment.,Pure consumer plays,,14-30 days,,,,3,,Siemens' independent VC unit. Source: next47.com,Medium,,,,7
Somesh Dash,IVP (Institutional Venture Partners),somesh@ivp.com,Menlo Park,California,United States,VC,"Series A, Series B, Growth","Consumer, SaaS, AI, Health, Entertainment",https://linkedin.com/in/someshdash,https://ivp.com,,,,,,,Tier 1,$3B+,"Twitter, Snap, Dropbox, Slack, Discord, Coinbase, Netflix, Grammarly",Yes,,,Medium (3-6 weeks),Verified — MX Valid,,"Greylock, Sequoia, Accel, Bessemer, a16z",GP / Decision Maker,,,,,2-3 weeks,14-30 days,,,,,"Best: Q1 (Jan-Mar, new fund year, deploying capital). Avoid: Aug, late Dec (vacation). [Source: industry standard]",Source: Investor's documented medium response time in database,,,,,,7
Tae Hea Nahm,Storm Ventures,tae@stormventures.com,Menlo Park,California,United States,VC,"Seed, Series A","Enterprise SaaS, AI, B2B",https://linkedin.com/in/taehenahm,https://stormventures.com,Yes,$500K-$5M,https://www.stormventures.com/pitch,,,,Tier 2,$200M,,Yes,,,,Verified — MX Valid,,,GP / Decision Maker,,,,Apply: https://www.stormventures.com/pitch,,,,,,,"Best: Q1 (Jan-Mar, new fund year, deploying capital). Avoid: Aug, late Dec (vacation). [Source: industry standard]",,,,,,,7
Target Global,Target Global,info@targetglobal.vc,Berlin,,Germany,VC,Seed / Series A / Growth,"Fintech, Marketplace, SaaS, Health",https://linkedin.com/company/target-global,https://targetglobal.vc,Yes,$500K-$30M,,,None,Not Contacted,High,$1B+,"Auto1, Delivery Hero (follow-on), Taxfix, wefox",Yes,4,,,,,,,GP,,,,,14-30 days,,,3,LinkedIn,,,Berlin-based multi-stage VC. Source: targetglobal.vc,Medium,,,,7
Team8,Team8,info@team8.vc,Tel Aviv,,Israel,VC / Studio,Seed / Series A,"Cybersecurity, Data, Enterprise AI, Fintech",https://linkedin.com/company/team8,https://team8.vc,Yes,$1M-$10M,,,None,Not Contacted,High,$500M,"Claroty, Hysolate, Illusive Networks",Yes,4,,,,,,,Studio/VC,,,,,14-30 days,,,3,LinkedIn,,,Israeli company-building platform. Source: team8.vc,Medium,,,,7
Tera Ventures (Irene Ala-Ruona),Tera Ventures,irene@tera.vc,Tallinn,,Estonia,VC,Pre-seed / Seed,"SaaS, Fintech, Marketplace, AI",https://linkedin.com/in/irenealaruona,https://tera.vc,Yes,$100K-$1M,,,None,Not Contacted,High,$55M,"Bolt (early), Veriff, Montonio",No,4,,,,,,,GP,,,,,7-14 days,,,3,LinkedIn,,,Top Estonian seed VC. Source: tera.vc. Estonia = Skype/Wise/Bolt origin.,Medium,,,,7
Tiffany Luck,GGV Capital / Notable Capital,tiffany@notable.vc,Menlo Park,California,United States,VC,"Seed, Series A, Series B","AI, Consumer, SaaS, Fintech",https://linkedin.com/in/tiffanyluck,https://notable.vc,,,,,,,Tier 1,$3.8B+,"Slack, Airbnb, Square, Grab, Peloton, Poshmark, Wish, Zendesk",Yes,,,Medium (3-6 weeks),Verified — MX Valid,,"Sequoia, Lightspeed, Tiger Global, a16z, Goodwater",GP / Decision Maker,,,,,2-3 weeks,14-30 days,,,,,"Best: Q1 (Jan-Mar, new fund year, deploying capital). Avoid: Aug, late Dec (vacation). [Source: industry standard]",Source: Investor's documented medium response time in database,,,,,,7
Timo Ahopelto,Inventure,timo@inventure.fi,Helsinki,,Finland,VC,Seed / Series A,"Deep Tech, SaaS, Health, Gaming",https://linkedin.com/in/timoahopelto,https://inventure.fi,Yes,$200K-$5M,,,None,Not Contacted,High,$180M,"Wolt (early), Swappie, Oura (early)",Yes,4,,,,,,,Founding Partner,,,,,14-30 days,,,3,LinkedIn,,,Top Finnish seed fund. Source: inventure.fi,Medium,,,,7
Toby Coppel,Mosaic Ventures,toby@mosaicventures.com,London,England,United Kingdom,VC,Series A / Series B,"AI, Enterprise, Crypto, Climate",https://linkedin.com/in/tobycoppel,https://mosaicventures.com,Yes,$1M-$10M,,,None,Not Contacted,High,$350M,"Graphcore, Chainalysis, Shift Technology",Yes,4,,,,,,,Founding Partner,,,,,14-30 days,,,3,Twitter/X,,,Ex-Yahoo. Strong enterprise/AI thesis. Source: mosaicventures.com,Medium,,,,7
Tom Loverro,IVP (Institutional Venture Partners),tom@ivp.com,Menlo Park,California,United States,VC,"Series A, Series B, Growth","Consumer, SaaS, AI, Health, Entertainment",https://linkedin.com/in/tomloverro,https://ivp.com,,,,,,,Tier 1,$3B+,"Twitter, Snap, Dropbox, Slack, Discord, Coinbase, Netflix, Grammarly",Yes,,,Medium (3-6 weeks),Verified — MX Valid,,"Greylock, Sequoia, Accel, Bessemer, a16z",GP / Decision Maker,,,,,2-3 weeks,14-30 days,,,,,"Best: Q1 (Jan-Mar, new fund year, deploying capital). Avoid: Aug, late Dec (vacation). [Source: industry standard]",Source: Investor's documented medium response time in database,,,,,,7
Unilever Ventures,Unilever Ventures,info@unileverventures.com,London,England,United Kingdom,CVC,Seed / Series A / Growth,"Consumer, DTC, Health, Food, Sustainability",https://linkedin.com/company/unilever-ventures,https://unileverventures.com,Yes,$500K-$10M,,,None,Not Contacted,High,$450M,"Dollar Shave Club, Graze, Nutrafol, Sir Kensington's",Yes,4,,,,,,,CVC,,,Consumer/FMCG brand synergy is key. Pitch the strategic fit to Unilever's brand portfolio.,Non-consumer / pure B2B enterprise,,14-30 days,,,,3,,Unilever's venture arm. Source: unileverventures.com,Medium,,,,7
Vishal Lugani,Acrew Capital,vishal@acrewcapital.com,San Francisco,California,United States,VC,"Seed, Series A","AI, Consumer, Enterprise, Fintech, Health",https://linkedin.com/in/vishallugani,https://acrewcapital.com,Yes,$500K-$10M,https://www.acrewcapital.com/pitch,,,,Tier 2,$800M,,Yes,,,,Verified — MX Valid,,,GP / Decision Maker,,,"Focused on cybersecurity, enterprise SaaS, marketplaces. Backs diverse founders. Source: acrewcapital.com/insights.",Apply: https://www.acrewcapital.com/pitch,,,Theresia Gouw — vocal about backing diverse founders. Source: acrewcapital.com/insights,,,"Not cybersecurity, enterprise SaaS, or marketplace; Not a diverse founder (strong preference) [Source: acrewcapital.com/insights, Twitter]","Best: Q1 (Jan-Mar). Avoid: Aug, late Dec. [Source: industry standard]",,,,,,,7
William Hockey,https://www.crunchbase.com/person/william-hockey,,San Francisco,California,United States,Angel,Early-stage,"Consumer, FinTech, SaaS, Crypto, Healthcare, Creator Economy",https://www.linkedin.com/in/william-hockey-04536710/,http://wi.lli.am/,,,,,None,Not Contacted,Medium,,"Plaid (co-founder), Column (founder)",No,4,"Talks: Plaid founding story, fintech infrastructure",Fast (1-2 weeks),,,"Ribbit Capital, a16z, Sequoia, Plaid alumni angels",Solo Angel,,Co-founded Plaid. He's publicly stated he invests in fintech infrastructure and API companies. He values founders building developer-facing financial tools.,Focused on fintech infrastructure and API companies. Values founders building developer-facing financial tools. Source: Plaid founding story talks.,,1 week,7-14 days,,4,Twitter/X,Not fintech infrastructure/API-focused; Not building developer-facing financial tools [Source: Plaid founding story talks],Best: Anytime — fast angel decisions. Avoid: Holiday weeks. [Source: general angel pattern],Source: Fast angel decisions; Plaid founding story,"Plaid co-founder, Column founder. Respected fintech operator-angel. [Source: General community reputation based on public founder testimonials, blog posts, podcast interviews, and published accounts. Not independently verified.]",Medium,,,,7
William McQuillan,Frontline Ventures,william@frontline.vc,Dublin,,Ireland,VC,Seed / Series A,"SaaS, Enterprise, Deep Tech, AI",https://linkedin.com/in/williammcquillan,https://frontline.vc,Yes,$500K-$5M,,,None,Not Contacted,High,$300M,"Pointy, ChannelSight, Logentries",Yes,4,Frontline blog: frontline.vc/thoughts,Active,,,,,GP,,,,,14-30 days,,,3,Twitter/X,,,Ireland's top VC. B2B focus. Source: frontline.vc,Medium,,,,7
Yann Ranchère,Eurazeo,yann@eurazeo.com,Paris,,France,VC,Seed / Series A / Growth,"Fintech, SaaS, Consumer, Health",https://linkedin.com/in/yannranchere,https://eurazeo.com,Yes,$1M-$50M,,,None,Not Contacted,High,$3B+,"Molotov, Vestiaire Collective, Backmarket, ManoMano",Yes,4,,,,,,,Partner,,,,,14-30 days,,,3,LinkedIn,,,Major French multi-stage PE/VC. Source: eurazeo.com,Medium,,,Check master DB,7
360 Capital,360 Capital,info@360cap.vc,Paris,,France,VC,Seed / Series A,"SaaS, AI, Deep Tech",https://linkedin.com/company/360-capital,https://360cap.vc,Yes,$500K-$5M,,,None,Not Contacted,Medium,$300M,"Algolia, Scality, StreamSets",Yes,3,,,,,,,GP,,,,,14-30 days,,,2,LinkedIn,,,French/European deep tech VC. Source: 360cap.vc,Medium,,,,6
4YFN (MWC Barcelona),,info@4yfn.com,Barcelona,,Spain,Competition,Seed / Series A,"Mobile, SaaS, AI, IoT",,https://4yfn.com,No,,https://4yfn.com,,None,Not Contacted,High,,Prize: Visibility at MWC (100K+ attendees). Startup awards. Source: 4yfn.com,No,4,,,,,,,Competition,,,,,,,N/A,,,,,Mobile World Congress startup event. Source: 4yfn.com,Medium,,,,6
Adam Carson,Point72 Ventures,adam@point72.com,Menlo Park,California,United States,VC,"Seed, Series A, Series B","AI, Health, Fintech, Consumer",https://linkedin.com/in/adamcarson,https://point72.com,Yes,$1M-$15M,,,,,Tier 1,$1B+,,Yes,,,,Verified — MX Valid,,,GP / Decision Maker,,,,,,,,,,,"Best: Q1 (Jan-Mar, new fund year, deploying capital). Avoid: Aug, late Dec (vacation). [Source: industry standard]",,,,,,,6
Alex Gurevich,Alex Gurevich,alex@javelinvp.com,San Francisco,California,United States,Angel,,"Media, Consumer Internet, Analytics, Health and Wellness",https://linkedin.com/in/alexg79,https://www.alexgurevich.com,,,,,None,Not Contacted,High,,,No,,,,Domain Mismatch,Email domain (javelinvp.com) != fund domain (alexgurevich.com),,Solo Angel,,,,,,1-14 days,,,,,"Best: Anytime. Avoid: Holiday weeks (late Dec, early Jan). [Source: general angel pattern]",Source: Typical angel investor timeline based on published seed-stage research,,Medium,,,,6
Alexander Giesecke,Picus Capital,alexander@picuscapital.com,Munich,,Germany,VC,Pre-seed / Seed,"SaaS, Fintech, Health",https://linkedin.com/in/alexandergiesecke,https://picuscapital.com,Yes,$250K-$3M,,,None,Not Contacted,Medium,$300M,"Trade Republic, Forto, Hygraph",No,3,,,,,,,GP,,,,,7-14 days,,,2,LinkedIn,,,Munich-based seed VC. Source: picuscapital.com,Medium,,,,6
Alexis Ohanian,Seven Seven Six,alexis@sevensevensix.com,Miami,,United States,VC,"Seed, Series A","Consumer, Creator Economy, Gaming, AI",https://linkedin.com/in/alexisohanian,https://www.sevensevensix.com,Yes,$500K-$5M,,,None,Not Contacted,,$1B+,"Reddit (co-founder), Coinbase, Instacart, Calm (776)",Yes,,,Very Fast (days),Verified — MX Valid,,"Seven Seven Six, Y Combinator, Initialized, SV Angel",GP / Decision Maker,,"At Seven Seven Six (776), he's publicly stated he backs 'culturally relevant' companies and founders from underrepresented backgrounds. He's accessible on social media. He's said he looks for founders who understand internet-native communities. Reference his Reddit background — he values community-driven growth. He moves relatively fast.",,,24-48 hours,1-7 days,,,,,"Best: Q1 (Jan-Mar, new fund year, deploying capital). Avoid: Aug, late Dec (vacation). [Source: industry standard]",Source: Investor's documented fast response time in database,,Medium,,,,6
Ali Tamaseb,DCVC (Data Collective),ali@dcvc.com,San Francisco,California,United States,VC,"Seed, Series A, Series B","AI, Deep Tech, Health, Climate, Computational",https://linkedin.com/in/alitamaseb,https://dcvc.com,,,,,,,Tier 1,$2B+,,Yes,,,,Verified — MX Valid,,,GP / Decision Maker,,,,,,,,,,,"Best: Q1 (Jan-Mar, new fund year, deploying capital). Avoid: Aug, late Dec (vacation). [Source: industry standard]",,,,,,,6
Andreas Göldi,b2venture (fka btov),andreas@b2venture.vc,Zurich,,Switzerland,VC,Seed / Series A,"SaaS, Deep Tech, Fintech, Health",https://linkedin.com/in/andreasgoldi,https://b2venture.vc,Yes,$500K-$5M,,,None,Not Contacted,Medium,$500M,"Inovio, Numbrs, Ava, Ledgy",Yes,3,,,,,,,Partner,,,,,14-30 days,,,2,LinkedIn,,,Swiss/German seed VC. Source: b2venture.vc,Medium,,,Check master DB,6
Andrew Schwab,5AM Ventures,andrew@5amventures.com,San Francisco,California,United States,VC,"Seed, Series A","Health, Biotech, Life Sciences, Digital Health",https://linkedin.com/in/andrewschwab,https://5amventures.com,,,,,,,Tier 1,$800M,,Yes,,,,Verified — MX Valid,,,GP / Decision Maker,,,,,,,,,,,"Best: Q1 (Jan-Mar, new fund year, deploying capital). Avoid: Aug, late Dec (vacation). [Source: industry standard]",,,,,,,6
Andy McLoughlin,https://www.crunchbase.com/person/andy-mcloughlin,andy@founderspledge.com,San Francisco,California,United States,Angel,,"Consumer, Healthcare, Hardware, Marketplace, SaaS",https://www.linkedin.com/in/andymcloughlin/,http://www.andymcloughlin.co/,,,,,None,Not Contacted,Medium,,"Huddle (co-founder), Uncork Capital",No,,,,Domain Mismatch,Email domain (founderspledge.com) != fund domain (andymcloughlin.co),"First Round, True Ventures, SV Angel, Floodgate",Solo Angel,,,,,,1-14 days,,,,,"Best: Anytime. Avoid: Holiday weeks (late Dec, early Jan). [Source: general angel pattern]",Source: Typical angel investor timeline based on published seed-stage research,,Medium,,,,6
Andy Vitus,Scale Venture Partners,andy@scalevp.com,Foster City,California,United States,VC,"Series A, Series B","SaaS, AI, Enterprise, Consumer",https://linkedin.com/in/andyvitus,https://scalevp.com,Yes,$5M-$25M,,,,,Tier 2,$1.5B+,,Yes,,,,Verified — MX Valid,,,GP / Decision Maker,,,,,,,,,,,"Best: Q1 (Jan-Mar, new fund year, deploying capital). Avoid: Aug, late Dec (vacation). [Source: industry standard]",,,,,,,6
Angel Gambino,Angel Gambino,angel.gambino@gmail.com,San Francisco,California,United States,Angel/LP/Emerging Manager,Seed,"Music, ""Neurodiversity (Autism, ADHD, etc)"", Psychedelics, Real Estate, Cannabis, Sports & Fitness, Accessibility Tech, AI (Artificial Intelligence), Animal, Behavioral Health, Alternative Proteins, Climate, Clean Tech, Community, Consumer, Content, Creator Economy, Digital Health, Enterprise, BioTech, EdTech (education technology), Events, FemTech, Fashion Tech, Film, Gaming & Esports, Mental Health Tech, Food & Beverage, Healthcare, Pet Solutions, SaaS, Wellness, Water Solutions, Video Tech, TV, Travel & Tourism, Telemedicine, Streaming, Tech for Good, Social Media, Software, Technology",https://linkedin.com/in/angelgambino,https://AngelGambino.com,No,$25K-$100K,,,None,Not Contacted,High,,,No,,Blog: angelgambino.com | Neurodiversity/impact investing content,,Personal Email — MX Valid,,various neurodiversity/impact angels,Solo Angel,,,,"Events: Angel Club events, Pitch Slam | DMs Open: Twitter/LinkedIn",,1-14 days,Fund thesis includes female/women founders. Source: fund investment thesis,,,,"Best: Anytime. Avoid: Holiday weeks (late Dec, early Jan). [Source: general angel pattern]",Source: Typical angel investor timeline based on published seed-stage research,,Medium,,,,6
Anya Schiess,,anya@healthy.vc,San Francisco,California,United States,Angel,,"Healthcare, Software",https://linkedin.com/in/anyaschiess,http://healthy.vc,,,,,None,Not Contacted,Low,,,No,,,,Verified — MX Valid,,,Solo Angel,,"At Slow Ventures, she's publicly stated she focuses on consumer and community-driven companies. Slow Ventures is known for unconventional bets.",,,,1-14 days,,,,,"Best: Anytime. Avoid: Holiday weeks (late Dec, early Jan). [Source: general angel pattern]",Source: Typical angel investor timeline based on published seed-stage research,,Medium,,,,6
